{"date":"27/03/2022","datecharts":"2022-03-27","title":"Sables rouges : comment expliquer ce phénomène ?","url":"https://www.francetvinfo.fr/monde/afrique/sahara-occidental/sables-rouges-comment-expliquer-ce-phenomene_5048269.html","urlTvNews":"https://www.francetvinfo.fr/replay-jt/france-2/20-heures/jt-de-20h-du-dimanche-27-mars-2022_4999542.html","media":"France 2"}
{"date":"22/03/2022","datecharts":"2022-03-22","title":"Présidentielle 2022 : l'environnement, thème oublié des débats... au grand dam des Français ?","url":"https://www.francetvinfo.fr/elections/presidentielle-2022-l-environnement-theme-oublie-des-debats-au-grand-dam-des-francais_5037086.html","urlTvNews":"https://www.francetvinfo.fr/replay-jt/france-2/20-heures/jt-de-20h-du-mardi-22-mars-2022_4989028.html","media":"France 2"}
{"date":"21/03/2022","datecharts":"2022-03-21","title":"Climat : une vague de chaleur inédite enregistrée en Antarctique","url":"https://www.francetvinfo.fr/monde/environnement/crise-climatique/climat-une-vague-de-chaleur-inedite-enregistree-en-antarctique_5033696.html","urlTvNews":"https://www.francetvinfo.fr/replay-jt/france-2/20-heures/jt-de-20h-du-lundi-21-mars-2022_4989030.html","media":"France 2"}
{"date":"17/03/2022","datecharts":"2022-03-17","title":"Centrales à charbon : elles tournent encore, malgré une fermeture définitive prévue fin mars","url":"https://www.francetvinfo.fr/monde/environnement/centrales-a-charbon-elles-tournent-encore-malgre-une-fermeture-definitive-prevue-finmars_5022271.html","urlTvNews":"https://www.francetvinfo.fr/replay-jt/france-2/20-heures/jt-de-20h-du-jeudi-17-mars-2022_4980639.html","media":"France 2"}
{"date":"16/03/2022","datecharts":"2022-03-16","title":"La petite Camargue à l'heure de l'hiver","url":"https://www.tf1info.fr/voyages/video-la-petite-camargue-a-l-heure-de-l-hiver-2213790.html","urlTvNews":"https://www.tf1info.fr/emission/le-20h-11001/extraits","media":"TF1"}
{"date":"16/03/2022","datecharts":"2022-03-16","title":"Éoliennes : en Laponie, les éleveurs de rennes protestent contre leur installation","url":"https://www.francetvinfo.fr/meteo/climat/eoliennes-en-laponie-les-eleveurs-de-rennes-protestent-contre-leur-installation_5019016.html","urlTvNews":"https://www.francetvinfo.fr/replay-jt/france-2/20-heures/jt-de-20h-du-mercredi-16-mars-2022_4978632.html","media":"France 2"}
{"date":"12/03/2022","datecharts":"2022-03-12","title":"Un jour en France : quatrième dose de vaccin, marches pour le climat... L'actualité du samedi 12 mars","url":"https://www.francetvinfo.fr/sante/maladie/coronavirus/vaccin/un-jour-en-france-quatrieme-dose-de-vaccin-marches-pour-le-climat-l-actualite-du-samedi-12-mars_5006181.html","urlTvNews":"https://www.francetvinfo.fr/replay-jt/france-2/20-heures/jt-de-20h-du-samedi-12-mars-2022_4976067.html","media":"France 2"}
{"date":"06/03/2022","datecharts":"2022-03-06","title":"Présidentielle 2022 : des militants en manque de campagne","url":"https://www.francetvinfo.fr/elections/presidentielle/presidentielle-2022-des-militants-en-manque-de-campagne_4994994.html","urlTvNews":"https://www.francetvinfo.fr/replay-jt/france-2/20-heures/jt-de-20h-du-dimanche-6-mars-2022_4964088.html","media":"France 2"}
{"date":"28/02/2022","datecharts":"2022-02-28","title":"Réchauffement climatique : des élus locaux refusent la classification en \"commune vulnérable\"","url":"https://www.francetvinfo.fr/meteo/climat/rechauffement-climatique-des-elus-locaux-refusent-la-classification-en-commune-vulnerable_4986645.html","urlTvNews":"https://www.francetvinfo.fr/replay-jt/france-2/20-heures/jt-de-20h-du-lundi-28-fevrier-2022_4951056.html","media":"France 2"}
{"date":"25/02/2022","datecharts":"2022-02-25","title":"L'Europe va-t-elle manquer de gaz ? \"Le vrai risque, c'est l'automne\", analyse François Lenglet","url":"https://www.tf1info.fr/international/video-guerre-en-ukraine-invasion-par-la-russie-de-poutine-l-europe-la-france-va-t-elle-manquer-de-gaz-le-vrai-risque-c-est-l-automne-analyse-francois-lenglet-2211816.html","urlTvNews":"https://www.tf1info.fr/emission/le-20h-11001/extraits/3.html","media":"TF1"}
{"date":"23/02/2022","datecharts":"2022-02-23","title":"Surpêche, réchauffement climatique... De nouvelles espèces de poissons menacées en France, annonce l'Ifremer","url":"https://www.francetvinfo.fr/monde/environnement/biodiversite/surpeche-rechauffement-climatique-de-nouvelles-especes-de-poissons-menacees-en-france-annonce-l-ifremer_4977846.html","urlTvNews":"https://www.francetvinfo.fr/replay-jt/france-2/20-heures/jt-de-20h-du-mercredi-23-fevrier-2022_4940028.html","media":"France 2"}
{"date":"23/02/2022","datecharts":"2022-02-23","title":"États-Unis : New York construit un mur anti-inondation pour faire face aux effets du réchauffement climatique","url":"https://www.francetvinfo.fr/monde/usa/etats-unis-new-york-construitun-mur-anti-inondations-pour-faire-face-aux-effets-du-rechauffement-climatique_4977792.html","urlTvNews":"https://www.francetvinfo.fr/replay-jt/france-2/20-heures/jt-de-20h-du-mercredi-23-fevrier-2022_4940028.html","media":"France 2"}
{"date":"23/02/2022","datecharts":"2022-02-23","title":"Simon Beck, l'artiste qui dessine dans la neige pour alerter sur la fragilité des montagnes","url":"https://www.francetvinfo.fr/culture/simon-beck-l-artiste-qui-dessine-dans-la-neige-pour-alerter-sur-la-fragilite-des-montagnes_4977843.html","urlTvNews":"https://www.francetvinfo.fr/replay-jt/france-2/20-heures/jt-de-20h-du-mercredi-23-fevrier-2022_4940028.html","media":"France 2"}
{"date":"22/02/2022","datecharts":"2022-02-22","title":"Groenland : exploration en terre inuit","url":"https://www.tf1info.fr/voyages/video-decouverte-exploration-en-terre-inuit-au-groenland-2211599.html","urlTvNews":"https://www.tf1info.fr/emission/le-20h-11001/extraits","media":"TF1"}
{"date":"16/02/2022","datecharts":"2022-02-16","title":"Cuba : le modèle \"soleil et plage\" menacé par l'érosion et la montée des eaux","url":"https://www.francetvinfo.fr/monde/cuba/cuba-le-modele-soleil-et-plage-menacepar-l-erosion-et-la-montee-des-eaux_4965480.html","urlTvNews":"https://www.francetvinfo.fr/replay-jt/france-2/20-heures/jt-de-20h-du-mercredi-16-fevrier-2022_4931101.html","media":"France 2"}
{"date":"11/02/2022","datecharts":"2022-02-11","title":"Sciences : le \"blob\" passionne les scientifiques et les enfants","url":"https://www.francetvinfo.fr/replay-jt/france-2/20-heures/sciences-le-blob-passionne-les-scientifiques-et-les-enfants_4956369.html","urlTvNews":"https://www.francetvinfo.fr/replay-jt/france-2/20-heures/jt-de-20h-du-vendredi-11-fevrier-2022_4925929.html","media":"France 2"}
{"date":"09/02/2022","datecharts":"2022-02-09","title":"Explorateurs, plongeurs : une vie à défendre les océans","url":"https://www.tf1info.fr/environnement-ecologie/video-explorateurs-plongeurs-une-vie-a-defendre-les-oceans-2210438.html","urlTvNews":"https://www.tf1info.fr/emission/le-20h-11001/extraits","media":"TF1"}
{"date":"26/01/2022","datecharts":"2022-01-26","title":"Prix de l'électricité : plus de 40 % des salariés d'EDF ont fait grève","url":"https://www.francetvinfo.fr/societe/nucleaire/prix-de-l-electricite-plus-de-40-des-salaries-d-edf-ont-fait-greve_4930677.html","urlTvNews":"https://www.francetvinfo.fr/replay-jt/france-2/20-heures/jt-de-20h-du-mercredi-26-janvier-2022_4912279.html","media":"France 2"}
{"date":"21/01/2022","datecharts":"2022-01-21","title":"Guadeloupe : de la dentelle pour sauver les coraux","url":"https://www.francetvinfo.fr/monde/environnement/biodiversite/guadeloupe-de-la-dentelle-pour-sauver-les-coraux_4926421.html","urlTvNews":"https://www.francetvinfo.fr/replay-jt/france-2/20-heures/jt-de-20h-du-samedi-22-janvier-2022_4912287.html","media":"France 2"}
{"date":"19/01/2022","datecharts":"2022-01-19","title":"VIDÉO - Polynésie : l'exceptionnelle découverte d'un photographe français au large de Tahiti","url":"https://www.tf1info.fr/voyages/video-polynesie-un-extraordinaire-jardin-de-corail-decouvert-au-large-de-tahiti-par-le-photographe-francais-alexis-rosenfeld-2207688.html","urlTvNews":"https://www.tf1info.fr/emission/le-20h-11001/extraits","media":"TF1"}
{"date":"05/01/2022","datecharts":"2022-01-05","title":"Londres : le Museum d’histoire naturelle consacre une exposition inédite aux animaux","url":"https://www.francetvinfo.fr/culture/londres-lemuseumdhistoirenaturelle-consacre-une-exposition-inedite-aux-animaux_4907133.html","urlTvNews":"https://www.francetvinfo.fr/replay-jt/france-2/20-heures/jt-de-20h-du-jeudi-6-janvier-2022_4884475.html","media":"France 2"}
{"date":"02/01/2022","datecharts":"2022-01-02","title":"Environnement : le gaz et le nucléaire sont-ils des énergies vertes ?","url":"https://www.francetvinfo.fr/societe/nucleaire/environnement-le-gaz-et-le-nucleaire-sont-ils-des-energies-vertes_4903243.html","urlTvNews":"https://www.francetvinfo.fr/replay-jt/france-2/20-heures/jt-de-20h-du-lundi-3-janvier-2022_4881613.html","media":"France 2"}
{"date":"01/01/2022","datecharts":"2022-01-01","title":"Érosion du littoral : deux falaises se décrochent en quelques jours près d'Étretat","url":"https://www.francetvinfo.fr/monde/environnement/erosion-du-littoral-deux-falaises-se-decrochent-en-quelques-jours-pres-d-etretat_4901977.html","urlTvNews":"https://www.francetvinfo.fr/replay-jt/france-2/20-heures/jt-de-20h-du-dimanche-2-janvier-2022_4881615.html","media":"France 2"}
{"date":"31/12/2021","datecharts":"2021-12-31","title":"Afrique du Sud : une clinique qui œuvre pour la survie des manchots","url":"https://www.francetvinfo.fr/monde/afrique/societe-africaine/afrique-du-sud-une-clinique-qui-oeuvre-pour-la-survie-des-manchots_4901129.html","urlTvNews":"https://www.francetvinfo.fr/replay-jt/france-2/20-heures/jt-de-20h-du-samedi-1-janvier-2022_4881617.html","media":"France 2"}
{"date":"25/12/2021","datecharts":"2021-12-25","title":"Environnement : en Islande, une usine dépollue l'air","url":"https://www.francetvinfo.fr/meteo/climat/environnement-en-islande-une-usine-depollue-l-air_4894713.html","urlTvNews":"https://www.francetvinfo.fr/replay-jt/france-2/20-heures/jt-de-20h-du-dimanche-26-decembre-2021_4873379.html","media":"France 2"}
{"date":"10/12/2021","datecharts":"2021-12-10","title":"États-Unis : des tornades violentes touchent régulièrement le pays","url":"https://www.francetvinfo.fr/meteo/tornade/etats-unis-des-tornades-violentes-touchent-regulierement-le-pays_4877941.html","urlTvNews":"https://www.francetvinfo.fr/replay-jt/france-2/20-heures/jt-de-20h-du-samedi-11-decembre-2021_4856869.html","media":"France 2"}
{"date":"07/12/2021","datecharts":"2021-12-07","title":"Neige artificielle : une solution qui ne fait pas l'unanimité","url":"https://www.francetvinfo.fr/economie/tourisme/neige-artificielle-une-solution-qui-ne-fait-pas-l-unanimite_4874209.html","urlTvNews":"https://www.francetvinfo.fr/replay-jt/france-2/20-heures/jt-de-20h-du-mercredi-8-decembre-2021_4849287.html","media":"France 2"}
{"date":"01/12/2021","datecharts":"2021-12-01","title":"Terres rares: des minéraux uniques au coeur d'une bataille mondiale","url":"https://www.francetvinfo.fr/monde/terres-rares-des-mineraux-uniques-au-coeur-d-une-bataille-mondiale_4867259.html","urlTvNews":"https://www.francetvinfo.fr/replay-jt/france-2/20-heures/jt-de-20h-du-jeudi-2-decembre-2021_4842017.html","media":"France 2"}
{"date":"25/11/2021","datecharts":"2021-11-25","title":"Photo hebdo : les meilleurs clichés de la semaine du vendredi 26 novembre","url":"https://www.francetvinfo.fr/monde/photo-hebdo-les-meilleurs-cliches-de-la-semaine-du-vendredi-26-novembre_4860491.html","urlTvNews":"https://www.francetvinfo.fr/replay-jt/france-2/20-heures/jt-de-20h-du-vendredi-26-novembre-2021_4834987.html","media":"France 2"}
{"date":"22/11/2021","datecharts":"2021-11-22","title":"Madagascar : le sud de l'île face à la pire famine de son histoire","url":"https://www.francetvinfo.fr/monde/afrique/societe-africaine/famine/madagascar-le-sud-de-l-ile-face-a-la-pire-famine-de-son-histoire_4856313.html","urlTvNews":"https://www.francetvinfo.fr/replay-jt/france-2/20-heures/jt-de-20h-du-mardi-23-novembre-2021_4831105.html","media":"France 2"}
{"date":"18/11/2021","datecharts":"2021-11-18","title":"Canada : pluies torrentielles et inondations en Colombie-Britannique, des milliers de personnes évacuées","url":"https://www.francetvinfo.fr/meteo/inondations/canada-pluies-torrentielles-et-inondations-en-colombie-britannique-des-milliers-de-personnes-evacuees_4851365.html","urlTvNews":"https://www.francetvinfo.fr/replay-jt/france-2/20-heures/jt-de-20h-du-vendredi-19-novembre-2021_4826971.html","media":"France 2"}
{"date":"13/11/2021","datecharts":"2021-11-13","title":"COP26 : le dépit des \"petits pays\" face à l'accord","url":"https://www.francetvinfo.fr/monde/environnement/cop26/cop26-le-depit-des-petits-pays-face-a-l-accord_4844845.html","urlTvNews":"https://www.francetvinfo.fr/replay-jt/france-2/20-heures/jt-de-20h-du-dimanche-14-novembre-2021_4823149.html","media":"France 2"}
{"date":"11/11/2021","datecharts":"2021-11-11","title":"VIDÉO - Ce couple de Français détient le record du monde de plongée sous la banquise","url":"https://www.tf1info.fr/voyages/video-mission-under-the-pole-ce-couple-de-francais-emmanuelle-et-ghislain-bardout-detient-le-record-du-monde-de-plongee-sous-la-banquise-dans-l-arctique-2201654.html","urlTvNews":"https://www.tf1info.fr/emission/le-20h-11001/extraits/5.html","media":"TF1"}
{"date":"07/11/2021","datecharts":"2021-11-07","title":"Eclairage public : ces villes qui économisent","url":"https://www.tf1info.fr/societe/video-eclairage-public-ces-villes-qui-economisent-2201324.html","urlTvNews":"https://www.tf1info.fr/emission/le-20h-11001/extraits/6.html","media":"TF1"}
{"date":"07/11/2021","datecharts":"2021-11-07","title":"Mangues en Sicile, lavande au Cachemire... à la découverte de cultures surprenantes","url":"https://www.tf1info.fr/environnement-ecologie/video-a-la-decouverte-de-ces-cultures-extraordinaires-2201329.html","urlTvNews":"https://www.tf1info.fr/emission/le-20h-11001/extraits/6.html","media":"TF1"}
{"date":"04/11/2021","datecharts":"2021-11-04","title":"Photo Hebdo : la chronique photo du vendredi 5 novembre","url":"https://www.francetvinfo.fr/replay-jt/france-2/20-heures/photo-hebdo-la-chronique-photo-du-vendredi-5-novembre_4834931.html","urlTvNews":"https://www.francetvinfo.fr/replay-jt/france-2/20-heures/jt-de-20h-du-vendredi-5-novembre-2021_4809705.html","media":"France 2"}
{"date":"03/11/2021","datecharts":"2021-11-03","title":"À Madagascar : ils sauvent les lémuriens","url":"https://www.tf1info.fr/international/video-a-madagascar-ils-sauvent-les-lemuriens-2201012.html","urlTvNews":"https://www.tf1info.fr/emission/le-20h-11001/extraits/6.html","media":"TF1"}
{"date":"02/11/2021","datecharts":"2021-11-02","title":"\"Une solution pour la planète\" : les forêts urbaines, outil essentiel pour rafraîchir les villes","url":"https://www.francetvinfo.fr/meteo/climat/une-solution-pour-la-planete-les-forets-urbaines-outil-essentiel-pour-rafraichir-les-villes_4831873.html","urlTvNews":"https://www.francetvinfo.fr/replay-jt/france-2/20-heures/jt-de-20h-du-mercredi-3-novembre-2021_4806897.html","media":"France 2"}
{"date":"01/11/2021","datecharts":"2021-11-01","title":"COP26 : les ravages de la déforestation sur l'Amazonie","url":"https://www.francetvinfo.fr/monde/ameriques/amazonie/cop26-les-ravages-de-la-deforestation-sur-l-amazonie_4830629.html","urlTvNews":"https://www.francetvinfo.fr/replay-jt/france-2/20-heures/jt-de-20h-du-mardi-2-novembre-2021_4806923.html","media":"France 2"}
{"date":"31/10/2021","datecharts":"2021-10-31","title":"COP26 : le sommet de la dernière chance pour réagir face au changement climatique ?","url":"https://www.francetvinfo.fr/monde/environnement/cop26/cop-26-le-sommet-de-la-derniere-chance-pour-reagir-face-au-changement-climatique_4829505.html","urlTvNews":"https://www.francetvinfo.fr/replay-jt/france-2/20-heures/jt-de-20h-du-lundi-1-novembre-2021_4805507.html","media":"France 2"}
{"date":"31/10/2021","datecharts":"2021-10-31","title":"COP26 : des pays réunis à Glasgow pour prendre des engagements contre le changement climatique","url":"https://www.francetvinfo.fr/monde/environnement/cop26/cop26-les-pays-reunis-a-glasgow-pour-prendre-des-engagements-contre-le-changement-climatique_4829521.html","urlTvNews":"https://www.francetvinfo.fr/replay-jt/france-2/20-heures/jt-de-20h-du-lundi-1-novembre-2021_4805507.html","media":"France 2"}
{"date":"31/10/2021","datecharts":"2021-10-31","title":"COP26 : feux de forêt, dégel, montée des eaux... Les conséquences mondiales du dérèglement climatique","url":"https://www.francetvinfo.fr/meteo/climat/environnement-feux-de-foret-degel-montees-des-eaux-les-consequences-mondiales-du-dereglement-climatique_4829469.html","urlTvNews":"https://www.francetvinfo.fr/replay-jt/france-2/20-heures/jt-de-20h-du-lundi-1-novembre-2021_4805507.html","media":"France 2"}
{"date":"28/10/2021","datecharts":"2021-10-28","title":"Plongeur de l'extrême : Laurent Marie, sapeur-pompier à Brest et passionné d'apnée en eaux glacées","url":"https://www.francetvinfo.fr/monde/environnement/biodiversite/plongeur-de-l-extreme-laurent-marie-sapeur-pompier-a-brest-et-passionne-d-apnee-en-eaux-glacees_4826379.html","urlTvNews":"https://www.francetvinfo.fr/replay-jt/france-2/20-heures/jt-de-20h-du-vendredi-29-octobre-2021_4800869.html","media":"France 2"}
{"date":"25/10/2021","datecharts":"2021-10-25","title":"Elizabeth II renonce à participer à la COP26","url":"https://www.tf1info.fr/international/video-elizabeth-ii-renonce-a-participer-a-la-cop-26-2200142.html","urlTvNews":"https://www.tf1info.fr/emission/le-20h-11001/extraits/6.html","media":"TF1"}
{"date":"21/10/2021","datecharts":"2021-10-21","title":"Amérique du Sud : le désert de l'Atacama, hôte de fleurs rares","url":"https://www.francetvinfo.fr/monde/environnement/biodiversite/amerique-du-sud-le-desert-de-l-atacama-hote-de-fleurs-rares_4818073.html","urlTvNews":"https://www.francetvinfo.fr/replay-jt/france-2/20-heures/jt-de-20h-du-vendredi-22-octobre-2021_4792291.html","media":"France 2"}
{"date":"19/10/2021","datecharts":"2021-10-19","title":"Côte atlantique : la mystérieuse invasion de poulpes inquiète pêcheurs et poissonniers","url":"https://www.tf1info.fr/environnement-ecologie/video-cote-atlantique-charente-maritime-bretagne-une-mysterieuse-invasion-de-poulpes-pourrait-faire-grimper-les-prix-des-crustaces-homards-crabes-et-coquillages-2199353.html","urlTvNews":"https://www.tf1info.fr/emission/le-20h-11001/extraits/7.html","media":"TF1"}
{"date":"19/10/2021","datecharts":"2021-10-19","title":"Arbres exotiques : une menace pour les forêts ?","url":"https://www.tf1info.fr/environnement-ecologie/video-arbres-exotiques-une-menace-pour-les-forets-2199569.html","urlTvNews":"https://www.tf1info.fr/emission/le-20h-11001/extraits/7.html","media":"TF1"}
{"date":"19/10/2021","datecharts":"2021-10-19","title":"Changement climatique : des documents internes prouvent que les pétroliers étaient au courant","url":"https://www.francetvinfo.fr/meteo/climat/changement-climatique-des-documents-internes-prouvent-que-les-petroliers-etaient-au-courant_4815177.html","urlTvNews":"https://www.francetvinfo.fr/replay-jt/france-2/20-heures/jt-de-20h-du-mercredi-20-octobre-2021_4789601.html","media":"France 2"}
{"date":"14/10/2021","datecharts":"2021-10-14","title":"Environnement : à la rencontre de ces Français qui fuient la ville pour changer de vie","url":"https://www.francetvinfo.fr/economie/tourisme/environnement-a-la-rencontre-de-ces-francais-qui-fuient-la-ville-pour-changer-de-vie_4809091.html","urlTvNews":"https://www.francetvinfo.fr/replay-jt/france-2/20-heures/jt-de-20h-du-vendredi-15-octobre-2021_4783817.html","media":"France 2"}
{"date":"14/10/2021","datecharts":"2021-10-14","title":"COP26 : la reine d'Angleterre irritée par l'inaction de certains chefs d'États","url":"https://www.francetvinfo.fr/monde/environnement/cop26/cop26-la-reine-d-angleterre-irritee-par-l-inaction-de-certains-chefs-d-etats_4809097.html","urlTvNews":"https://www.francetvinfo.fr/replay-jt/france-2/20-heures/jt-de-20h-du-vendredi-15-octobre-2021_4783817.html","media":"France 2"}
{"date":"10/10/2021","datecharts":"2021-10-10","title":"Suède : abattre des arbres pour lutter contre le réchauffement climatique","url":"https://www.francetvinfo.fr/monde/environnement/biodiversite/suede-abattre-des-arbres-pour-lutter-contre-le-rechauffement-climatique_4803823.html","urlTvNews":"https://www.francetvinfo.fr/replay-jt/france-2/20-heures/jt-de-20h-du-lundi-11-octobre-2021_4779905.html","media":"France 2"}
{"date":"08/10/2021","datecharts":"2021-10-08","title":"Antarctique : le \"paradis blanc\" toujours plus menacé","url":"https://www.francetvinfo.fr/meteo/climat/antarctique-le-paradis-blanc-toujours-plus-menace_4801377.html","urlTvNews":"https://www.francetvinfo.fr/replay-jt/france-2/20-heures/jt-de-20h-du-samedi-9-octobre-2021_4779909.html","media":"France 2"}
{"date":"04/10/2021","datecharts":"2021-10-04","title":"Pyrénées-Orientales : les mystères de la forêt de Massane","url":"https://www.tf1info.fr/environnement-ecologie/video-pyrenees-orientales-les-mysteres-de-la-foret-de-massane-2198188.html","urlTvNews":"https://www.tf1info.fr/emission/le-20h-11001/extraits/8.html","media":"TF1"}
{"date":"04/10/2021","datecharts":"2021-10-04","title":"Océans : l'inquiétante disparition des coraux","url":"https://www.francetvinfo.fr/meteo/climat/oceans-l-inquietante-disparition-des-coraux_4796283.html","urlTvNews":"https://www.francetvinfo.fr/replay-jt/france-2/20-heures/jt-de-20h-du-mardi-5-octobre-2021_4771721.html","media":"France 2"}
{"date":"28/09/2021","datecharts":"2021-09-28","title":"Le Mont-Blanc a perdu près d'un mètre en quatre ans","url":"https://www.tf1info.fr/environnement-ecologie/video-le-mont-blanc-a-perdu-pres-d-un-metre-en-quatre-ans-2197634.html","urlTvNews":"https://www.tf1info.fr/emission/le-20h-11001/extraits/8.html","media":"TF1"}
{"date":"23/09/2021","datecharts":"2021-09-23","title":"Moustiques : pourquoi prolifèrent-ils encore en automne dans certains départements ?","url":"https://www.tf1info.fr/societe/video-moustiques-pourquoi-proliferent-ils-encore-en-automne-dans-certains-departements-2197118.html","urlTvNews":"https://www.tf1info.fr/emission/le-20h-11001/extraits/8.html","media":"TF1"}
{"date":"20/09/2021","datecharts":"2021-09-20","title":"États-Unis : à l'ONU, Joe Biden affirme ne pas vouloir de \"guerre froide\" avec la Chine","url":"https://www.francetvinfo.fr/monde/usa/joe-biden/etats-unis-a-l-onu-joe-biden-affirme-ne-pas-vouloir-de-guerre-froide-avec-la-chine_4779459.html","urlTvNews":"https://www.francetvinfo.fr/replay-jt/france-2/20-heures/jt-de-20h-du-mardi-21-septembre-2021_4755989.html","media":"France 2"}
{"date":"14/09/2021","datecharts":"2021-09-14","title":"Hausse des prix : comment le pouvoir d'achat des Français se porte-t-il en cette rentrée 2021 ?","url":"https://www.tf1info.fr/conso/inflation-cout-de-la-vie-hausse-des-prix-comment-se-porte-le-pouvoir-d-achat-des-francais-en-cette-rentree-2021-2196309.html","urlTvNews":"https://www.tf1info.fr/emission/le-20h-11001/extraits/9.html","media":"TF1"}
{"date":"13/09/2021","datecharts":"2021-09-13","title":"Gard : comment expliquer ces précipitations exceptionnelles ?","url":"https://www.francetvinfo.fr/meteo/inondations/gard-comment-expliquer-ces-precipitations-exceptionnelles_4771311.html","urlTvNews":"https://www.francetvinfo.fr/replay-jt/france-2/20-heures/jt-de-20h-du-mardi-14-septembre-2021_4747971.html","media":"France 2"}
{"date":"12/09/2021","datecharts":"2021-09-12","title":"Inde : la lavande se cultive aussi sur le toit du monde","url":"https://www.tf1info.fr/voyages/video-inde-la-lavande-se-cultive-aussi-sur-le-toit-du-monde-2196222.html","urlTvNews":"https://www.tf1info.fr/emission/le-20h-11001/extraits/9.html","media":"TF1"}
{"date":"07/09/2021","datecharts":"2021-09-07","title":"Allemagne : les trois candidats qui pourraient succéder à Angela Merkel","url":"https://www.francetvinfo.fr/monde/europe/allemagne/allemagne-les-trois-candidats-qui-pourraient-succeder-a-angela-merkel_4764589.html","urlTvNews":"https://www.francetvinfo.fr/replay-jt/france-2/20-heures/jt-de-20h-du-mercredi-8-septembre-2021_4741947.html","media":"France 2"}
{"date":"02/09/2021","datecharts":"2021-09-02","title":"Marseille : un Congrès mondial de la nature pour la préservation de la biodiversité","url":"https://www.francetvinfo.fr/monde/environnement/biodiversite/marseille-un-congres-mondial-de-la-nature-pour-la-preservation-de-la-biodiversite_4759221.html","urlTvNews":"https://www.francetvinfo.fr/replay-jt/france-2/20-heures/jt-de-20h-du-vendredi-3-septembre-2021_4737289.html","media":"France 2"}
{"date":"02/09/2021","datecharts":"2021-09-02","title":"Tempête Ida : Le bilan s'alourdit, la Maison Blanche décrète l'état d'urgence","url":"https://www.francetvinfo.fr/monde/usa/tempete-ida-le-bilan-s-alourdit-la-maison-blanche-decrete-l-etat-d-urgence_4759251.html","urlTvNews":"https://www.francetvinfo.fr/replay-jt/france-2/20-heures/jt-de-20h-du-vendredi-3-septembre-2021_4737289.html","media":"France 2"}
{"date":"25/08/2021","datecharts":"2021-08-25","title":"Michel Barnier invité du 20H de TF1","url":"https://www.tf1info.fr/politique/video-michel-barnier-invite-du-20h-de-tf1-2194717.html","urlTvNews":"https://www.tf1info.fr/emission/le-20h-11001/extraits/10.html","media":"TF1"}
{"date":"25/08/2021","datecharts":"2021-08-25","title":"Canicule et grêle dans le Var : des phénomènes extrêmes expliqués par des experts","url":"https://www.tf1info.fr/meteo/video-canicule-et-grele-dans-le-var-des-phenomenes-extremes-expliques-par-des-experts-evelyne-dheliat-2194628.html","urlTvNews":"https://www.tf1info.fr/emission/le-20h-11001/extraits/10.html","media":"TF1"}
{"date":"21/08/2021","datecharts":"2021-08-21","title":"Réchauffement climatique : la Mer de Glace va-t-elle disparaître ?","url":"https://www.francetvinfo.fr/monde/environnement/rechauffement-climatique-la-mer-de-glace-va-t-elle-disparaitre_4745395.html","urlTvNews":"https://www.francetvinfo.fr/replay-jt/france-2/20-heures/jt-de-20h-du-dimanche-22-aout-2021_4726851.html","media":"France 2"}
{"date":"21/08/2021","datecharts":"2021-08-21","title":"Environnement : comment se régénère la nature après un incendie ?","url":"https://www.francetvinfo.fr/faits-divers/incendie/environnement-comment-se-regenere-la-nature-apres-un-incendie_4745419.html","urlTvNews":"https://www.francetvinfo.fr/replay-jt/france-2/20-heures/jt-de-20h-du-dimanche-22-aout-2021_4726851.html","media":"France 2"}
{"date":"18/08/2021","datecharts":"2021-08-18","title":"Var : l’un des plus importants incendies des 20 dernières années","url":"https://www.francetvinfo.fr/faits-divers/incendie/var-lun-des-plus-importants-incendies-des-20-dernieres-annees_4742535.html","urlTvNews":"https://www.francetvinfo.fr/replay-jt/france-2/20-heures/jt-de-20h-du-jeudi-19-aout-2021_4721403.html","media":"France 2"}
{"date":"11/08/2021","datecharts":"2021-08-11","title":"Les pics de chaleur se multiplient en Europe","url":"https://www.tf1info.fr/environnement-ecologie/video-les-pics-de-chaleur-se-multiplient-en-europe-2193689.html","urlTvNews":"https://www.tf1info.fr/emission/le-20h-11001/extraits/11.html","media":"TF1"}
{"date":"09/08/2021","datecharts":"2021-08-09","title":"VIDÉO - \"Ça ressemble plus à un désert qu’à une Mer de glace\" : le plus grand glacier de France menacé de disparition","url":"https://www.tf1info.fr/environnement-ecologie/video-ca-ressemble-plus-a-un-desert-qu-a-une-mer-de-glace-le-plus-grand-glacier-de-france-menace-de-disparition-2193471.html","urlTvNews":"https://www.tf1info.fr/emission/le-20h-11001/extraits/12.html","media":"TF1"}
{"date":"08/08/2021","datecharts":"2021-08-08","title":"Climat : alerte rouge pour la planète","url":"https://www.tf1info.fr/environnement-ecologie/video-climat-alerte-rouge-pour-la-planete-2193467.html","urlTvNews":"https://www.tf1info.fr/emission/le-20h-11001/extraits/12.html","media":"TF1"}
{"date":"24/07/2021","datecharts":"2021-07-24","title":"Climat : le GIEC se penche sur un nouveau rapport","url":"https://www.francetvinfo.fr/sante/environnement-et-sante/climat-legiecse-penche-sur-un-nouveaurapport_4715875.html","urlTvNews":"https://www.francetvinfo.fr/replay-jt/france-2/20-heures/jt-de-20h-du-dimanche-25-juillet-2021_4692783.html","media":"France 2"}
{"date":"21/07/2021","datecharts":"2021-07-21","title":"Incendies : l'Amérique du Nord sous les flammes","url":"https://www.francetvinfo.fr/monde/canada/incendies-l-amerique-du-nord-sous-les-flammes_4712587.html","urlTvNews":"https://www.francetvinfo.fr/replay-jt/france-2/20-heures/jt-de-20h-du-jeudi-22-juillet-2021_4686865.html","media":"France 2"}
{"date":"18/07/2021","datecharts":"2021-07-18","title":"Sibérie : des incendies ravagent 800 000 hectares de forêts","url":"https://www.francetvinfo.fr/faits-divers/incendie/siberie-des-incendies-ravagent-800-000-hectares-de-forets_4708661.html","urlTvNews":"https://www.francetvinfo.fr/replay-jt/france-2/20-heures/jt-de-20h-du-lundi-19-juillet-2021_4684015.html","media":"France 2"}
{"date":"16/07/2021","datecharts":"2021-07-16","title":"Climat : après les inondations en Allemagne et en Belgique, les leçons à tirer du GIEC","url":"https://www.francetvinfo.fr/meteo/climat/environnement-apres-les-inondations-en-allemagne-et-en-belgique-les-lecons-a-tirer-du-giec_4706339.html","urlTvNews":"https://www.francetvinfo.fr/replay-jt/france-2/20-heures/jt-de-20h-du-samedi-17-juillet-2021_4684019.html","media":"France 2"}
{"date":"15/07/2021","datecharts":"2021-07-15","title":"Climat : comment expliquer les crues exceptionnelles ?","url":"https://www.francetvinfo.fr/meteo/climat/climat-comment-expliquer-les-crues-exceptionnelles_4705255.html","urlTvNews":"https://www.francetvinfo.fr/replay-jt/france-2/20-heures/jt-de-20h-du-vendredi-16-juillet-2021_4678909.html","media":"France 2"}
{"date":"15/07/2021","datecharts":"2021-07-15","title":"Inondations : y-a-t-il un lien entre la goutte froide et les dômes de chaleur ?","url":"https://www.francetvinfo.fr/meteo/climat/inondations-y-a-t-ilun-lien-entre-la-goutte-froide-et-les-domes-de-chaleur_4705257.html","urlTvNews":"https://www.francetvinfo.fr/replay-jt/france-2/20-heures/jt-de-20h-du-vendredi-16-juillet-2021_4678909.html","media":"France 2"}
{"date":"10/07/2021","datecharts":"2021-07-10","title":"Vagues de chaleur en Espagne : la France est-elle menacée ?","url":"https://www.francetvinfo.fr/meteo/climat/vagues-de-chaleur-en-espagne-la-france-est-elle-menacee_4698299.html","urlTvNews":"https://www.francetvinfo.fr/replay-jt/france-2/20-heures/jt-de-20h-du-dimanche-11-juillet-2021_4675005.html","media":"France 2"}
{"date":"08/07/2021","datecharts":"2021-07-08","title":"Réchauffement climatique : les cactus en danger en Arizona","url":"https://www.francetvinfo.fr/monde/environnement/biodiversite/rechauffement-climatique-les-cactus-en-danger-en-arizona_4696187.html","urlTvNews":"https://www.francetvinfo.fr/replay-jt/france-2/20-heures/jt-de-20h-du-vendredi-9-juillet-2021_4669909.html","media":"France 2"}
{"date":"28/06/2021","datecharts":"2021-06-28","title":"Records de chaleur battus : il fait aussi chaud au Canada que dans le Sahara","url":"https://www.tf1info.fr/meteo/video-des-records-de-chaleur-battus-dans-l-ouest-des-etats-unis-et-du-canada-2190158.html","urlTvNews":"https://www.tf1info.fr/emission/le-20h-11001/extraits/15.html","media":"TF1"}
{"date":"28/06/2021","datecharts":"2021-06-28","title":"Madagascar : une famine causée par le réchauffement climatique","url":"https://www.francetvinfo.fr/monde/afrique/madagascar/madagascar-une-famine-causee-par-le-rechauffement-climatique_4683471.html","urlTvNews":"https://www.francetvinfo.fr/replay-jt/france-2/20-heures/jt-de-20h-du-mardi-29-juin-2021_4656613.html","media":"France 2"}
{"date":"27/06/2021","datecharts":"2021-06-27","title":"Canicule : l'Amérique du Nord étouffe sous un dôme de chaleur","url":"https://www.francetvinfo.fr/monde/canada/canicule-l-amerique-du-nord-etouffe-sous-un-dome-de-chaleur_4682295.html","urlTvNews":"https://www.francetvinfo.fr/replay-jt/france-2/20-heures/jt-de-20h-du-lundi-28-juin-2021_4656617.html","media":"France 2"}
{"date":"22/06/2021","datecharts":"2021-06-22","title":"Climat : la fonte des glaciers, une menace à prendre très au sérieux","url":"https://www.francetvinfo.fr/meteo/climat/climat-la-fonte-des-glaciers-une-menace-a-prendre-tres-au-serieux_4675799.html","urlTvNews":"https://www.francetvinfo.fr/replay-jt/france-2/20-heures/jt-de-20h-du-mercredi-23-juin-2021_4648839.html","media":"France 2"}
{"date":"21/06/2021","datecharts":"2021-06-21","title":"Intempéries : comment expliquer l'intensification des phénomènes climatiques ?","url":"https://www.francetvinfo.fr/meteo/orages/intemperies-comment-expliquer-l-intensification-des-phenomenes-climatiques_4674505.html","urlTvNews":"https://www.francetvinfo.fr/replay-jt/france-2/20-heures/jt-de-20h-du-mardi-22-juin-2021_4647409.html","media":"France 2"}
{"date":"21/06/2021","datecharts":"2021-06-21","title":"Des inondations impressionnantes et récurrentes à Reims","url":"https://www.tf1info.fr/societe/video-des-inondations-impressionnantes-et-recurrentes-a-reims-2189525.html","urlTvNews":"https://www.tf1info.fr/emission/le-20h-11001/extraits/15.html","media":"TF1"}
{"date":"21/06/2021","datecharts":"2021-06-21","title":"Supercellules orageuses : comment expliquer ces phénomènes violents ?","url":"https://www.tf1info.fr/meteo/video-supercellules-oragueuses-comment-expliquer-ces-phenomenes-violents-2189526.html","urlTvNews":"https://www.tf1info.fr/emission/le-20h-11001/extraits/15.html","media":"TF1"}
{"date":"10/06/2021","datecharts":"2021-06-10","title":"Sommet du G7 : premières retrouvailles entre leaders","url":"https://www.francetvinfo.fr/monde/usa/joe-biden/sommet-du-g7-premieres-retrouvailles-entre-leaders_4660251.html","urlTvNews":"https://www.francetvinfo.fr/replay-jt/france-2/20-heures/jt-de-20h-du-vendredi-11-juin-2021_4633551.html","media":"France 2"}
{"date":"04/06/2021","datecharts":"2021-06-04","title":"Réchauffement climatique : les lacs en manque d'oxygène","url":"https://www.francetvinfo.fr/animaux/especes-menacees/rechauffement-climatique-les-lacs-en-manque-d-oxygene_4652235.html","urlTvNews":"https://www.francetvinfo.fr/replay-jt/france-2/20-heures/jt-de-20h-du-samedi-5-juin-2021_4629311.html","media":"France 2"}
{"date":"21/05/2021","datecharts":"2021-05-21","title":"Antarctique : un iceberg de 170 kilomètres de long à la dérive","url":"https://www.francetvinfo.fr/meteo/climat/antarctique-un-iceberg-de-170-kilometres-de-long-a-la-derive_4634089.html","urlTvNews":"https://www.francetvinfo.fr/replay-jt/france-2/20-heures/jt-de-20h-du-samedi-22-mai-2021_4611631.html","media":"France 2"}
{"date":"18/05/2021","datecharts":"2021-05-18","title":"Singapour : le pari de la \"nation verte\" pour lutter contre le réchauffement climatique","url":"https://www.francetvinfo.fr/meteo/climat/singapour-le-pari-de-la-nation-verte-pour-lutter-contre-le-rechauffement-climatique_4630079.html","urlTvNews":"https://www.francetvinfo.fr/replay-jt/france-2/20-heures/jt-de-20h-du-mercredi-19-mai-2021_4603905.html","media":"France 2"}
{"date":"11/05/2021","datecharts":"2021-05-11","title":"Après le gel, c’est la sécheresse qui inquiète les agriculteurs","url":"https://www.tf1info.fr/meteo/video-apres-le-gel-c-est-la-secheresse-qui-inquiete-les-agriculteurs-2185944.html","urlTvNews":"https://www.tf1info.fr/emission/le-20h-11001/extraits/18.html","media":"TF1"}
{"date":"09/05/2021","datecharts":"2021-05-09","title":"Intempéries : des agriculteurs à la recherche de plantes résistantes aux aléas climatiques","url":"https://www.francetvinfo.fr/economie/emploi/metiers/agriculture/intemperies-des-agriculteurs-a-la-recherche-de-plantes-resistantes-aux-aleas-climatiques_4618965.html","urlTvNews":"https://www.francetvinfo.fr/replay-jt/france-2/20-heures/jt-de-20h-du-lundi-10-mai-2021_4380305.html","media":"France 2"}
{"date":"04/05/2021","datecharts":"2021-05-04","title":"Nathan Paulin, le funambule de l’extrême qui va vous donner le vertige","url":"https://www.tf1info.fr/voyages/video-nathan-paulin-skyline-le-funambule-de-l-extreme-qui-marche-dans-le-ciel-et-donne-le-vertige-2185226.html","urlTvNews":"https://www.tf1info.fr/emission/le-20h-11001/extraits/18.html","media":"TF1"}
{"date":"03/05/2021","datecharts":"2021-05-03","title":"Biodiversité : Wally, le baleineau égaré en Méditerranée, se trouve actuellement dans le port de Sète","url":"https://www.francetvinfo.fr/monde/environnement/biodiversite-wally-le-baleineau-egare-en-mediterranee-se-trouve-actuellement-dans-le-port-de-sete_4611167.html","urlTvNews":"https://www.francetvinfo.fr/replay-jt/france-2/20-heures/jt-de-20h-du-mardi-4-mai-2021_4371505.html","media":"France 2"}
{"date":"02/05/2021","datecharts":"2021-05-02","title":"Climat : l'été sera chaud, estime Météo France","url":"https://www.francetvinfo.fr/meteo/canicule/climat-l-ete-sera-chaud-estime-meteo-france_4609851.html","urlTvNews":"https://www.francetvinfo.fr/replay-jt/france-2/20-heures/jt-de-20h-du-lundi-3-mai-2021_4371509.html","media":"France 2"}
{"date":"29/04/2021","datecharts":"2021-04-29","title":"Royaume-Uni : pourquoi les falaises s'effondrent-elles ?","url":"https://www.francetvinfo.fr/meteo/climat/royaume-uni-pourquoi-les-falaises-s-effondrent-elles_4606305.html","urlTvNews":"https://www.francetvinfo.fr/replay-jt/france-2/20-heures/jt-de-20h-du-vendredi-30-avril-2021_4366773.html","media":"France 2"}
{"date":"26/04/2021","datecharts":"2021-04-26","title":"La sécheresse inquiète les agriculteurs","url":"https://www.tf1info.fr/economie/video-la-secheresse-inquiete-les-agriculteurs-2184613.html","urlTvNews":"https://www.tf1info.fr/emission/le-20h-11001/extraits/19.html","media":"TF1"}
{"date":"25/04/2021","datecharts":"2021-04-25","title":"À la découverte des Maldives, le plus bel aquarium du monde","url":"https://www.tf1info.fr/voyages/video-a-la-decouverte-des-maldives-le-plus-bel-aquarium-du-monde-2184517.html","urlTvNews":"https://www.tf1info.fr/emission/le-20h-11001/extraits/19.html","media":"TF1"}
{"date":"21/04/2021","datecharts":"2021-04-21","title":"Afrique : la grande muraille verte peine à atteindre ses objectifs","url":"https://www.francetvinfo.fr/monde/afrique/environnement-africain/afrique-la-grande-muraille-verte-peine-a-atteindre-ses-objectifs_4382499.html","urlTvNews":"https://www.francetvinfo.fr/replay-jt/france-2/20-heures/jt-de-20h-du-jeudi-22-avril-2021_4356743.html","media":"France 2"}
{"date":"15/04/2021","datecharts":"2021-04-15","title":"Camions électriques : une alternative crédible au diesel ?","url":"https://www.tf1info.fr/environnement-ecologie/video-camions-electriques-une-alternative-credible-au-diesel-2183633.html","urlTvNews":"https://www.tf1info.fr/emission/le-20h-11001/extraits/20.html","media":"TF1"}
{"date":"09/04/2021","datecharts":"2021-04-09","title":"Gel : les agriculteurs déplorent des pertes historiques","url":"https://www.francetvinfo.fr/economie/emploi/metiers/agriculture/gel-les-agriculteurs-deplorent-des-pertes-historiques_4367281.html","urlTvNews":"https://www.francetvinfo.fr/replay-jt/france-2/20-heures/jt-de-20h-du-samedi-10-avril-2021_4345119.html","media":"France 2"}
{"date":"29/03/2021","datecharts":"2021-03-29","title":"Des records de température battus pour un mois de mars","url":"https://www.tf1info.fr/meteo/video-des-records-de-temperature-battus-pour-un-mois-de-mars-2182208.html","urlTvNews":"https://www.tf1info.fr/emission/le-20h-11001/extraits/21.html","media":"TF1"}
{"date":"14/03/2021","datecharts":"2021-03-14","title":"Angleterre : l'érosion fait disparaître des villages","url":"https://www.francetvinfo.fr/monde/royaume-uni/angleterre-l-erosion-fait-disparaitre-des-villages_4334411.html","urlTvNews":"https://www.francetvinfo.fr/replay-jt/france-2/20-heures/jt-de-20h-du-lundi-15-mars-2021_4308915.html","media":"France 2"}
{"date":"07/03/2021","datecharts":"2021-03-07","title":"Mundaka, une perle de la côte basque espagnole","url":"https://www.tf1info.fr/voyages/video-mundaka-une-perle-de-la-cote-basque-espagnole-2180241.html","urlTvNews":"https://www.tf1info.fr/emission/le-20h-11001/extraits/23.html","media":"TF1"}
{"date":"27/02/2021","datecharts":"2021-02-27","title":"Convention climat : les participants très insatisfaits du gouvernement","url":"https://www.francetvinfo.fr/monde/environnement/convention-citoyenne-sur-le-climat/convention-climat-les-participants-tres-insatisfaits-du-gouvernement_4314717.html","urlTvNews":"https://www.francetvinfo.fr/replay-jt/france-2/20-heures/jt-de-20h-du-dimanche-28-fevrier-2021_4290973.html","media":"France 2"}
{"date":"26/02/2021","datecharts":"2021-02-26","title":"Environnement : l’ours polaire menacé par la fonte de la banquise","url":"https://www.francetvinfo.fr/monde/russie/environnement-lours-polaire-menace-par-la-fonte-de-la-banquise_4313605.html","urlTvNews":"https://www.francetvinfo.fr/replay-jt/france-2/20-heures/jt-de-20h-du-samedi-27-fevrier-2021_4290975.html","media":"France 2"}
{"date":"24/02/2021","datecharts":"2021-02-24","title":"Nutri-score, Éco-score : peut-on se fier aux étiquettes sur les aliments ?","url":"https://www.tf1info.fr/conso/video-nutri-score-eco-score-peut-on-se-fier-aux-etiquettes-sur-les-aliments-2179242.html","urlTvNews":"https://www.tf1info.fr/emission/le-20h-11001/extraits/23.html","media":"TF1"}
{"date":"24/02/2021","datecharts":"2021-02-24","title":"Ours polaires, pandas... le business des naissances dans les zoos","url":"https://www.tf1info.fr/economie/ours-polaires-pandas-le-business-des-naissances-dans-les-zoos-2179324.html","urlTvNews":"https://www.tf1info.fr/emission/le-20h-11001/extraits/23.html","media":"TF1"}
{"date":"20/02/2021","datecharts":"2021-02-20","title":"Islande : le réchauffement climatique menace les glaciers","url":"https://www.francetvinfo.fr/meteo/climat/islande-le-rechauffement-climatique-menace-les-glaciers_4305865.html","urlTvNews":"https://www.francetvinfo.fr/replay-jt/france-2/20-heures/jt-de-20h-du-dimanche-21-fevrier-2021_4281729.html","media":"France 2"}
{"date":"06/02/2021","datecharts":"2021-02-06","title":"Inde : une vallée engloutie après la rupture d’un glacier de l’Himalaya","url":"https://www.francetvinfo.fr/monde/inde/inde-une-vallee-engloutie-apres-la-rupture-dun-glacier-de-lhimalaya_4287725.html","urlTvNews":"https://www.francetvinfo.fr/replay-jt/france-2/20-heures/jt-de-20h-du-dimanche-7-fevrier-2021_4266255.html","media":"France 2"}
{"date":"20/01/2021","datecharts":"2021-01-20","title":"Environnement : l’agrivoltaïsme séduit les agriculteurs","url":"https://www.francetvinfo.fr/economie/energie/environnement-lagrivoltaisme-seduit-les-agriculteurs_4267107.html","urlTvNews":"https://www.francetvinfo.fr/replay-jt/france-2/20-heures/jt-de-20h-du-jeudi-21-janvier-2021_4240641.html","media":"France 2"}
{"date":"14/01/2021","datecharts":"2021-01-14","title":"Environnement : 2021 sera décisive dans la lutte contre le réchauffement climatique","url":"https://www.francetvinfo.fr/monde/environnement/environnement-2021-sera-decisive-dans-la-lutte-contre-le-rechauffement-climatique_4259483.html","urlTvNews":"https://www.francetvinfo.fr/replay-jt/france-2/20-heures/jt-de-20h-du-vendredi-15-janvier-2021_4233929.html","media":"France 2"}
{"date":"14/12/2020","datecharts":"2020-12-14","title":"Climat : un référendum pour inscrire la défense de l'environnement dans la Constitution","url":"https://www.francetvinfo.fr/monde/environnement/convention-citoyenne-sur-le-climat/climat-emmanuel-macron-propose-un-referendum-pour-inscrire-l-environnement-dans-la-constitution_4221177.html","urlTvNews":"https://www.francetvinfo.fr/replay-jt/france-2/20-heures/jt-de-20h-du-mardi-15-decembre-2020_4194691.html","media":"France 2"}
{"date":"14/12/2020","datecharts":"2020-12-14","title":"À la découverte d'un des plus grands lagons de l'océan indien à Mayotte","url":"https://www.tf1info.fr/voyages/video-a-la-decouverte-d-un-des-plus-grands-lagons-de-l-ocean-indien-a-mayotte-2172975.html","urlTvNews":"https://www.tf1info.fr/emission/le-20h-11001/extraits/29.html","media":"TF1"}
{"date":"10/12/2020","datecharts":"2020-12-10","title":"Réchauffement climatique : de nouvelles espèces pour sauver les forêts","url":"https://www.francetvinfo.fr/meteo/climat/rechauffement-climatique-de-nouvelles-especes-pour-sauver-les-forets_4216353.html","urlTvNews":"https://www.francetvinfo.fr/replay-jt/france-2/20-heures/jt-de-20h-du-vendredi-11-decembre-2020_4190321.html","media":"France 2"}
{"date":"06/12/2020","datecharts":"2020-12-06","title":"Réchauffement climatique : un iceberg à la dérive","url":"https://www.francetvinfo.fr/meteo/climat/rechauffement-climatique-un-iceberg-a-la-derive_4210897.html","urlTvNews":"https://www.francetvinfo.fr/replay-jt/france-2/20-heures/jt-de-20h-du-lundi-7-decembre-2020_4185793.html","media":"France 2"}
{"date":"06/12/2020","datecharts":"2020-12-06","title":"Relocalisations : ces entreprises ont choisi de revenir en France","url":"https://www.tf1info.fr/economie/video-relocalisations-ces-entreprises-ont-choisi-de-revenir-en-france-2172241.html","urlTvNews":"https://www.tf1info.fr/emission/le-20h-11001/extraits/30.html","media":"TF1"}
{"date":"12/11/2020","datecharts":"2020-11-12","title":"Environnement : les glaciers du massif du Mont-Blanc menacés par le réchauffement climatique","url":"https://www.francetvinfo.fr/meteo/neige/environnement-les-glaciers-du-massif-du-mont-blanc-menaces-par-le-rechauffement-climatique_4180467.html","urlTvNews":"https://www.francetvinfo.fr/replay-jt/france-2/20-heures/jt-de-20h-du-vendredi-13-novembre-2020_4154265.html","media":"France 2"}
{"date":"06/11/2020","datecharts":"2020-11-06","title":"Présidentielle américaine : les premiers défis de Joe Biden à la tête du pays","url":"https://www.francetvinfo.fr/monde/usa/joe-biden/presidentielle-americaine-les-premiers-defis-de-joe-biden-a-la-tete-du-pays_4172689.html","urlTvNews":"https://www.francetvinfo.fr/replay-jt/france-2/20-heures/jt-de-20h-du-samedi-7-novembre-2020_4150159.html","media":"France 2"}
{"date":"25/10/2020","datecharts":"2020-10-25","title":"Élection américaine : comment Donald Trump est-il perçu dans le Nebraska ?","url":"https://www.tf1info.fr/international/video-election-americaine-comment-donald-trump-est-il-percu-dans-le-nebraska-2168290.html","urlTvNews":"https://www.tf1info.fr/emission/le-20h-11001/extraits/34.html","media":"TF1"}
{"date":"12/10/2020","datecharts":"2020-10-12","title":"Réchauffement climatique : voici, en 3D, à quoi ressembleront nos champs en 2050","url":"https://www.tf1info.fr/environnement-ecologie/video-rechauffement-climatique-voici-en-3d-a-quoi-ressembleront-nos-champs-en-2050-2167129.html","urlTvNews":"https://www.tf1info.fr/emission/le-20h-11001/extraits/35.html","media":"TF1"}
{"date":"10/10/2020","datecharts":"2020-10-10","title":"Réchauffement climatique : les conséquences de la fonte du pergélisol en Sibérie","url":"https://www.francetvinfo.fr/monde/russie/rechauffement-climatique-fonte-du-pergelisol-en-siberie_4137707.html","urlTvNews":"https://www.francetvinfo.fr/replay-jt/france-2/20-heures/jt-de-20h-du-dimanche-11-octobre-2020_4118157.html","media":"France 2"}
{"date":"05/10/2020","datecharts":"2020-10-05","title":"Tempête Alex : un manque de prévention face aux risques d'intempéries ?","url":"https://www.francetvinfo.fr/meteo/tempete/tempete-alex/tempete-alex-un-manque-de-prevention-face-aux-risques-d-intemperies_4131151.html","urlTvNews":"https://www.francetvinfo.fr/replay-jt/france-2/20-heures/jt-de-20h-du-mardi-6-octobre-2020_4107631.html","media":"France 2"}
{"date":"04/10/2020","datecharts":"2020-10-04","title":"Tempête Alex : le réchauffement climatique mis en cause","url":"https://www.francetvinfo.fr/meteo/tempete/tempete-alex/tempete-alex-le-rechauffement-climatique-mis-en-cause_4129937.html","urlTvNews":"https://www.francetvinfo.fr/replay-jt/france-2/20-heures/jt-de-20h-du-lundi-5-octobre-2020_4107635.html","media":"France 2"}
{"date":"23/09/2020","datecharts":"2020-09-23","title":"Chine : le pays envisage la neutralité carbone d'ici 2060","url":"https://www.francetvinfo.fr/monde/asie/pollution-en-chine/chine-le-pays-envisage-la-neutralite-carbone-d-ici-2060_4117395.html","urlTvNews":"https://www.francetvinfo.fr/replay-jt/france-2/20-heures/jt-de-20h-du-jeudi-24-septembre-2020_4094439.html","media":"France 2"}
{"date":"23/09/2020","datecharts":"2020-09-23","title":"Le grand format : la Bretagne et l'Île-de-France sont-elles de nouvelles terres de vignerons ?","url":"https://www.tf1info.fr/regions/video-le-grand-format-la-bretagne-et-l-ile-de-france-sont-elles-de-nouvelles-terres-de-vignerons-2165499.html","urlTvNews":"https://www.tf1info.fr/emission/le-20h-11001/extraits/36.html","media":"TF1"}
{"date":"15/09/2020","datecharts":"2020-09-15","title":"Le grand format : des fruits exotiques made in Sicile","url":"https://www.tf1info.fr/environnement-ecologie/video-le-grand-format-des-fruits-exotiques-made-in-sicile-2164776.html","urlTvNews":"https://www.tf1info.fr/emission/le-20h-11001/extraits/36.html","media":"TF1"}
{"date":"14/09/2020","datecharts":"2020-09-14","title":"Incendies aux États-Unis : l'offensive climatosceptique de Donald Trump","url":"https://www.francetvinfo.fr/monde/usa/presidentielle/donald-trump/incendies-aux-etats-unis-l-offensive-climatosceptique-de-donald-trump_4107301.html","urlTvNews":"https://www.francetvinfo.fr/replay-jt/france-2/20-heures/jt-de-20h-du-mardi-15-septembre-2020_4085315.html","media":"France 2"}
{"date":"14/09/2020","datecharts":"2020-09-14","title":"Bassin parisien : le nouvel El Dorado des viticulteurs ?","url":"https://www.francetvinfo.fr/economie/emploi/metiers/agriculture/bassin-parisien-le-nouvel-el-dorado-des-viticulteurs_4107315.html","urlTvNews":"https://www.francetvinfo.fr/replay-jt/france-2/20-heures/jt-de-20h-du-mardi-15-septembre-2020_4085315.html","media":"France 2"}
{"date":"12/09/2020","datecharts":"2020-09-12","title":"États-Unis : réchauffement climatique, sécheresse, pourquoi les incendies sont de plus en plus violents","url":"https://www.francetvinfo.fr/meteo/secheresse/etats-unis-rechauffement-climatique-secheresse-pourquoi-les-incendies-sont-de-plus-en-plus-violents_4104817.html","urlTvNews":"https://www.francetvinfo.fr/replay-jt/france-2/20-heures/jt-de-20h-du-dimanche-13-septembre-2020_4085323.html","media":"France 2"}
{"date":"25/08/2020","datecharts":"2020-08-25","title":"Des étés toujours plus chauds à Nîmes","url":"https://www.tf1info.fr/meteo/video-des-etes-toujours-plus-chauds-a-nimes-2162880.html","urlTvNews":"https://www.tf1info.fr/emission/le-20h-11001/extraits/38.html","media":"TF1"}
{"date":"23/08/2020","datecharts":"2020-08-23","title":"À la découverte du glacier du Grand Méan, un air de Patagonie","url":"https://www.tf1info.fr/regions/video-a-la-decouverte-du-glacier-du-grand-mean-un-air-de-patagonie-2162684.html","urlTvNews":"https://www.tf1info.fr/emission/le-20h-11001/extraits/38.html","media":"TF1"}
{"date":"21/08/2020","datecharts":"2020-08-21","title":"Sécheresse : les vignes à l'épreuve du climat","url":"https://www.francetvinfo.fr/economie/emploi/metiers/agriculture/secheresse-les-vignes-a-l-epreuve-du-climat_4082341.html","urlTvNews":"https://www.francetvinfo.fr/replay-jt/france-2/20-heures/jt-de-20h-du-samedi-22-aout-2020_4066755.html","media":"France 2"}
{"date":"16/08/2020","datecharts":"2020-08-16","title":"Réchauffement climatique : le point de non-retour","url":"https://www.francetvinfo.fr/meteo/climat/rechauffement-climatique-le-point-de-non-retour_4077723.html","urlTvNews":"https://www.francetvinfo.fr/replay-jt/france-2/20-heures/jt-de-20h-du-lundi-17-aout-2020_4060019.html","media":"France 2"}
{"date":"08/08/2020","datecharts":"2020-08-08","title":"VIDÉO - Canicule : quand les prévisions du bulletin fictif d’Evelyne Dhéliat pour août 2050 deviennent réalité","url":"https://www.tf1info.fr/meteo/video-canicule-aout-2020-quand-les-previsions-du-bulletin-fictif-d-evelyne-dheliat-pour-aout-2050-deviennent-realite-2125451.html","urlTvNews":"https://www.tf1info.fr/emission/le-20h-11001/extraits/39.html","media":"TF1"}
{"date":"29/07/2020","datecharts":"2020-07-29","title":"Climat : Des vagues de chaleur plus fréquentes","url":"https://www.francetvinfo.fr/meteo/climat/climat-des-vagues-de-chaleur-plus-frequentes_4061841.html","urlTvNews":"https://www.francetvinfo.fr/replay-jt/france-2/20-heures/jt-de-20h-du-jeudi-30-juillet-2020_4041253.html","media":"France 2"}
{"date":"20/07/2020","datecharts":"2020-07-20","title":"Environnement : 80 ans pour sauver les ours polaires","url":"https://www.francetvinfo.fr/decouverte/ours/environnement-80-ans-pour-sauver-les-ours-polaires_4052249.html","urlTvNews":"https://www.francetvinfo.fr/replay-jt/france-2/20-heures/jt-de-20h-du-mardi-21-juillet-2020_4029561.html","media":"France 2"}
{"date":"30/06/2020","datecharts":"2020-06-30","title":"Énergie : peut-on se passer du nucléaire ?","url":"https://www.francetvinfo.fr/economie/energie/energie-peut-on-se-passer-du-nucleaire_4030261.html","urlTvNews":"https://www.francetvinfo.fr/replay-jt/france-2/20-heures/jt-de-20h-du-mercredi-1-juillet-2020_4005817.html","media":"France 2"}
{"date":"20/06/2020","datecharts":"2020-06-20","title":"Climat : la convention citoyenne soumettra 149 propositions au gouvernement","url":"https://www.francetvinfo.fr/monde/environnement/convention-citoyenne-sur-le-climat/climat-la-convention-citoyenne-soumettra-149-propositions-au-gouvernement_4016853.html","urlTvNews":"https://www.francetvinfo.fr/replay-jt/france-2/20-heures/jt-de-20h-du-dimanche-21-juin-2020_3994543.html","media":"France 2"}
{"date":"07/06/2020","datecharts":"2020-06-07","title":"Expédition dans le lac glacier des Kerguelen","url":"https://www.tf1info.fr/voyages/video-expedition-dans-le-lac-glacier-des-kerguelen-2155991.html","urlTvNews":"https://www.tf1info.fr/emission/le-20h-11001/extraits/44.html","media":"TF1"}
{"date":"02/06/2020","datecharts":"2020-06-02","title":"Le lac Ladoga, repère des phoques en danger","url":"https://www.francetvinfo.fr/monde/russie/le-lac-ladoga-repere-des-phoques-en-danger_3993781.html","urlTvNews":"https://www.francetvinfo.fr/replay-jt/france-2/20-heures/jt-de-20h-du-mercredi-3-juin-2020_3963535.html","media":"France 2"}
{"date":"16/04/2020","datecharts":"2020-04-16","title":"Pollution : les effets bénéfiques du confinement","url":"https://www.francetvinfo.fr/sante/maladie/coronavirus/pollution-les-effets-benefiques-du-confinement_3922263.html","urlTvNews":"https://www.francetvinfo.fr/replay-jt/france-2/20-heures/jt-de-20h-du-vendredi-17-avril-2020_3888727.html","media":"France 2"}
{"date":"09/03/2020","datecharts":"2020-03-09","title":"À la découverte d'un zoo en altitude en Suisse","url":"https://www.tf1info.fr/culture/video-a-la-decouverte-d-un-zoo-en-altitude-en-suisse-2147682.html","urlTvNews":"https://www.tf1info.fr/emission/le-20h-11001/extraits/56.html","media":"TF1"}
{"date":"09/03/2020","datecharts":"2020-03-09","title":"Risque-t-on de l'attraper dans le métro ? En faisant du sport ? Les réponses à vos questions sur le coronavirus (2/4)","url":"https://www.tf1info.fr/sante/video-coronavirus-le-docteur-kierzek-repond-a-toutes-vos-questions-sur-le-coronavirus-2-3-2147248.html","urlTvNews":"https://www.tf1info.fr/emission/le-20h-11001/extraits/56.html","media":"TF1"}
{"date":"25/02/2020","datecharts":"2020-02-25","title":"Laponie : le combat des Samis, éleveurs de rennes","url":"https://www.francetvinfo.fr/monde/environnement/biodiversite/laponie-le-combat-des-samis-eleveurs-de-rennes_3842541.html","urlTvNews":"https://www.francetvinfo.fr/replay-jt/france-2/20-heures/jt-de-20h-du-mercredi-26-fevrier-2020_3814555.html","media":"France 2"}
{"date":"12/02/2020","datecharts":"2020-02-12","title":"Météo : comment expliquer ces tempêtes en série ?","url":"https://www.tf1info.fr/meteo/video-meteo-comment-expliquer-ces-tempetes-en-serie-2145456.html","urlTvNews":"https://www.tf1info.fr/emission/le-20h-11001/extraits/58.html","media":"TF1"}
{"date":"12/02/2020","datecharts":"2020-02-12","title":"Réchauffement climatique : le calvaire de la Mer de Glace","url":"https://www.francetvinfo.fr/politique/emmanuel-macron/rechauffement-climatique-le-calvaire-de-la-mer-de-glace_3824967.html","urlTvNews":"https://www.francetvinfo.fr/replay-jt/france-2/20-heures/jt-de-20h-du-jeudi-13-fevrier-2020_3798027.html","media":"France 2"}
{"date":"11/02/2020","datecharts":"2020-02-11","title":"Environnement : 50 000 logements en péril en France","url":"https://www.francetvinfo.fr/meteo/tempete/environnement-50-000-logements-en-peril-en-france_3823427.html","urlTvNews":"https://www.francetvinfo.fr/replay-jt/france-2/20-heures/jt-de-20h-du-mercredi-12-fevrier-2020_3796549.html","media":"France 2"}
{"date":"11/02/2020","datecharts":"2020-02-11","title":"Chamonix : focus sur la fonte de la Mer de glace","url":"https://www.tf1info.fr/environnement-ecologie/video-chamonix-focus-sur-la-fonte-de-la-mer-de-glace-2145362.html","urlTvNews":"https://www.tf1info.fr/emission/le-20h-11001/extraits/58.html","media":"TF1"}
{"date":"10/02/2020","datecharts":"2020-02-10","title":"VIDÉO - Avec le réchauffement climatique, Saint-Nazaire risque de se retrouver les pieds dans l’eau","url":"https://www.tf1info.fr/environnement-ecologie/video-montee-des-eaux-avec-le-rechauffement-climatique-saint-nazaire-risque-de-se-retrouver-les-pieds-dans-l-eau-2145154.html","urlTvNews":"https://www.tf1info.fr/emission/le-20h-11001/extraits/58.html","media":"TF1"}
{"date":"09/02/2020","datecharts":"2020-02-09","title":"Réchauffement climatique : les projections alarmantes de l'Agence européenne pour l'environnement","url":"https://www.francetvinfo.fr/meteo/inondations/rechauffement-climatique-les-projections-alarmantes-de-l-agence-europeenne-pour-l-environnement_3820647.html","urlTvNews":"https://www.francetvinfo.fr/replay-jt/france-2/20-heures/jt-de-20h-du-lundi-10-fevrier-2020_3796553.html","media":"France 2"}
{"date":"09/02/2020","datecharts":"2020-02-09","title":"L’impact du réchauffement climatique en 2050","url":"https://www.tf1info.fr/environnement-ecologie/video-l-impact-du-rechauffement-climatique-en-2050-2145156.html","urlTvNews":"https://www.tf1info.fr/emission/le-20h-11001/extraits/58.html","media":"TF1"}
{"date":"05/02/2020","datecharts":"2020-02-05","title":"Agriculture : faut-il taxer la viande pour protéger l'environnement ?","url":"https://www.francetvinfo.fr/economie/emploi/metiers/agriculture/agriculture-faut-il-taxer-la-viande-pour-proteger-l-environnement_3815409.html","urlTvNews":"https://www.francetvinfo.fr/replay-jt/france-2/20-heures/jt-de-20h-du-jeudi-6-fevrier-2020_3788609.html","media":"France 2"}
{"date":"05/02/2020","datecharts":"2020-02-05","title":"Pourquoi les sardines rétrécissent-elles ?","url":"https://www.tf1info.fr/environnement-ecologie/video-pourquoi-les-sardines-retrecissent-elles-2144849.html","urlTvNews":"https://www.tf1info.fr/emission/le-20h-11001/extraits/58.html","media":"TF1"}
{"date":"21/01/2020","datecharts":"2020-01-21","title":"Arctique : une nouvelle voie commerciale très convoitée","url":"https://www.francetvinfo.fr/meteo/climat/arctique-une-nouvelle-voie-commerciale-tres-convoitee_3795987.html","urlTvNews":"https://www.francetvinfo.fr/replay-jt/france-2/20-heures/jt-de-20h-du-mercredi-22-janvier-2020_3767949.html","media":"France 2"}
{"date":"15/01/2020","datecharts":"2020-01-15","title":"Face à la montée des eaux, Jakarta déménage","url":"https://www.tf1info.fr/environnement-ecologie/video-face-a-la-montee-des-eaux-jakarta-demenage-2142978.html","urlTvNews":"https://www.tf1info.fr/emission/le-20h-11001/extraits/60.html","media":"TF1"}
{"date":"09/01/2020","datecharts":"2020-01-09","title":"Australie : le Premier ministre dans la tourmente","url":"https://www.francetvinfo.fr/monde/asie/incendies-en-australie/australie-le-premier-ministre-dans-la-tourmente_3779479.html","urlTvNews":"https://www.francetvinfo.fr/replay-jt/france-2/20-heures/jt-de-20h-du-vendredi-10-janvier-2020_3754073.html","media":"France 2"}
{"date":"07/01/2020","datecharts":"2020-01-07","title":"Incendies en Australie : un phénomène ravageur dû au changement climatique","url":"https://www.tf1info.fr/environnement-ecologie/incendies-en-australie-un-phenomene-ravageur-du-au-changement-climatique-2142177.html","urlTvNews":"https://www.tf1info.fr/emission/le-20h-11001/extraits/61.html","media":"TF1"}
{"date":"04/01/2020","datecharts":"2020-01-04","title":"Incendies en Australie : la vigueur des flammes ne faiblit pas","url":"https://www.francetvinfo.fr/monde/asie/incendies-en-australie/incendies-en-australie-la-vigueur-des-flammes-ne-faiblit-pas_3772309.html","urlTvNews":"https://www.francetvinfo.fr/replay-jt/france-2/20-heures/jt-de-20h-du-dimanche-5-janvier-2020_3750941.html","media":"France 2"}
{"date":"01/01/2020","datecharts":"2020-01-01","title":"Incendies en Australie : le réchauffement climatique en cause ?","url":"https://www.francetvinfo.fr/faits-divers/incendie/incendies-en-australie-le-rechauffement-climatique-en-cause_3768633.html","urlTvNews":"https://www.francetvinfo.fr/replay-jt/france-2/20-heures/jt-de-20h-du-jeudi-2-janvier-2020_3742661.html","media":"France 2"}
{"date":"27/12/2019","datecharts":"2019-12-27","title":"Montagne : les stations font face au changement climatique","url":"https://www.francetvinfo.fr/meteo/neige/montagne-les-stations-font-face-au-changement-climatique_3762861.html","urlTvNews":"https://www.francetvinfo.fr/replay-jt/france-2/20-heures/jt-de-20h-du-samedi-28-decembre-2019_3741067.html","media":"France 2"}
{"date":"26/12/2019","datecharts":"2019-12-26","title":"Photo hebdo : Royaume-Uni, Notre-Dame, Jacques Chirac, Greta Thunberg... l'actualité de l'année en images","url":"https://www.francetvinfo.fr/monde/environnement/greta-thunberg/photo-hebdo-royaume-uni-notre-dame-jacques-chirac-greta-thunberg-l-actualite-de-l-annee-en-images_3761751.html","urlTvNews":"https://www.francetvinfo.fr/replay-jt/france-2/20-heures/jt-de-20h-du-vendredi-27-decembre-2019_3734483.html","media":"France 2"}
{"date":"20/12/2019","datecharts":"2019-12-20","title":"Australie : 3 millions d'hectares de forêt partis en fumée","url":"https://www.francetvinfo.fr/meteo/climat/australie-3-millions-d-hectares-de-foret-partis-en-fumee_3754589.html","urlTvNews":"https://www.francetvinfo.fr/replay-jt/france-2/20-heures/jt-de-20h-du-samedi-21-decembre-2019_3731521.html","media":"France 2"}
{"date":"20/12/2019","datecharts":"2019-12-20","title":"Pays-Bas : l'État condamné pour inaction climatique","url":"https://www.francetvinfo.fr/meteo/climat/pays-bas-l-etat-condamne-pour-inaction-climatique_3754601.html","urlTvNews":"https://www.francetvinfo.fr/replay-jt/france-2/20-heures/jt-de-20h-du-samedi-21-decembre-2019_3731521.html","media":"France 2"}
{"date":"13/12/2019","datecharts":"2019-12-13","title":"Laponie : les rennes menacés par le réchauffement climatique","url":"https://www.francetvinfo.fr/meteo/climat/laponie-les-rennes-menaces-par-le-rechauffement-climatique_3744891.html","urlTvNews":"https://www.francetvinfo.fr/replay-jt/france-2/20-heures/jt-de-20h-du-samedi-14-decembre-2019_3722019.html","media":"France 2"}
{"date":"08/12/2019","datecharts":"2019-12-08","title":"Les titres du JT de 20H","url":"https://www.tf1info.fr/replay/video-les-titres-du-jt-de-20h-2854-2139952.html","urlTvNews":"https://www.tf1info.fr/emission/le-20h-11001/extraits/63.html","media":"TF1"}
{"date":"05/12/2019","datecharts":"2019-12-05","title":"Russie : des ours polaires aux portes d’un village","url":"https://www.francetvinfo.fr/decouverte/ours/russie-des-ours-polaires-aux-portes-dun-village_3733777.html","urlTvNews":"https://www.francetvinfo.fr/replay-jt/france-2/20-heures/jt-de-20h-du-vendredi-6-decembre-2019_3705599.html","media":"France 2"}
{"date":"02/12/2019","datecharts":"2019-12-02","title":"Inondations en série dans le Sud-Est : un phénomène exceptionnel ?","url":"https://www.tf1info.fr/meteo/video-inondations-en-serie-dans-le-sud-est-un-phenomene-exceptionnel-2139353.html","urlTvNews":"https://www.tf1info.fr/emission/le-20h-11001/extraits/63.html","media":"TF1"}
{"date":"01/12/2019","datecharts":"2019-12-01","title":"Réchauffement climatique : quels pays émettent le plus de CO2 ?","url":"https://www.francetvinfo.fr/monde/chine/rechauffement-climatique-quels-pays-emettent-le-plus-de-co2_3727975.html","urlTvNews":"https://www.francetvinfo.fr/replay-jt/france-2/20-heures/jt-de-20h-du-lundi-2-decembre-2019_3702233.html","media":"France 2"}
{"date":"22/11/2019","datecharts":"2019-11-22","title":"Mike Horn piégé en Arctique à cause de la fonte des glaces","url":"https://www.francetvinfo.fr/sports/sports-extremes/mike-horn-piege-en-antarctique-a-cause-de-la-fonte-des-glaces_3716169.html","urlTvNews":"https://www.francetvinfo.fr/replay-jt/france-2/20-heures/jt-de-20h-du-samedi-23-novembre-2019_3692349.html","media":"France 2"}
{"date":"12/11/2019","datecharts":"2019-11-12","title":"Réchauffement climatique : les côtes françaises sensibles aux montées des eaux ?","url":"https://www.tf1info.fr/environnement-ecologie/video-rechauffement-climatique-les-cotes-francaises-sensibles-aux-montees-des-eaux-2137634.html","urlTvNews":"https://www.tf1info.fr/emission/le-20h-11001/extraits/65.html","media":"TF1"}
{"date":"10/11/2019","datecharts":"2019-11-10","title":"À la découverte des moulins de la Mer de Glace","url":"https://www.tf1info.fr/regions/video-a-la-decouverte-des-moulins-de-la-mer-de-glace-2137430.html","urlTvNews":"https://www.tf1info.fr/emission/le-20h-11001/extraits/65.html","media":"TF1"}
{"date":"04/11/2019","datecharts":"2019-11-04","title":"À la faveur du réchauffement climatique, la grenade arrive en France","url":"https://www.tf1info.fr/environnement-ecologie/video-a-la-faveur-du-rechauffement-climatique-la-grenade-arrive-en-france-2136912.html","urlTvNews":"https://www.tf1info.fr/emission/le-20h-11001/extraits/66.html","media":"TF1"}
{"date":"31/10/2019","datecharts":"2019-10-31","title":"Jane Fonda, militante de toujours, est devenue une figure des manifestations contre le réchauffement climatique","url":"https://www.francetvinfo.fr/culture/cinema/jane-fonda-le-parcours-d-une-infatigable-militante_3684747.html","urlTvNews":"https://www.francetvinfo.fr/replay-jt/france-2/20-heures/jt-de-20h-du-vendredi-1-novembre-2019_3655993.html","media":"France 2"}
{"date":"30/10/2019","datecharts":"2019-10-30","title":"Châtaigniers d'Ardèche : une filière menacée par la sécheresse","url":"https://www.tf1info.fr/environnement-ecologie/video-chataigniers-d-ardeche-une-filiere-menacee-par-la-secheresse-2136486.html","urlTvNews":"https://www.tf1info.fr/emission/le-20h-11001/extraits/66.html","media":"TF1"}
{"date":"29/10/2019","datecharts":"2019-10-29","title":"Fonte des glaciers: le Perito Moreno, exception argentine","url":"https://www.francetvinfo.fr/meteo/climat/fonte-des-glaciers-le-perito-moreno-exception-argentine_3681987.html","urlTvNews":"https://www.francetvinfo.fr/replay-jt/france-2/20-heures/jt-de-20h-du-mercredi-30-octobre-2019_3652593.html","media":"France 2"}
{"date":"23/10/2019","datecharts":"2019-10-23","title":"Indonésie : Jakarta bientôt déménagée à cause de la montée des eaux ?","url":"https://www.francetvinfo.fr/meteo/climat/indonesie-jakarta-bientot-demenagee-a-cause-de-la-montee-des-eaux_3673919.html","urlTvNews":"https://www.francetvinfo.fr/replay-jt/france-2/20-heures/jt-de-20h-du-jeudi-24-octobre-2019_3644023.html","media":"France 2"}
{"date":"21/10/2019","datecharts":"2019-10-21","title":"Disparition des glaciers : les barrages vont-ils manquer d'eau ?","url":"https://www.tf1info.fr/environnement-ecologie/disparition-des-glaciers-les-barrages-vont-ils-manquer-d-eau-2135663.html","urlTvNews":"https://www.tf1info.fr/emission/le-20h-11001/extraits/67.html","media":"TF1"}
{"date":"20/10/2019","datecharts":"2019-10-20","title":"Pour lutter contre la sécheresse, les producteurs de champignons ont inventé des systèmes ingénieux","url":"https://www.tf1info.fr/societe/pour-lutter-contre-la-secheresse-les-producteurs-de-champignons-ont-invente-des-systemes-ingenieux-2135577.html","urlTvNews":"https://www.tf1info.fr/emission/le-20h-11001/extraits/67.html","media":"TF1"}
{"date":"14/10/2019","datecharts":"2019-10-14","title":"Les offres d'électricité \"verte\" sont-elles vraiment vertes ?","url":"https://www.francetvinfo.fr/economie/industrie/electricite-quand-un-contrat-d-energie-verte-se-fournit-dans-une-centrale-a-charbon-allemande_3660621.html","urlTvNews":"https://www.francetvinfo.fr/replay-jt/france-2/20-heures/jt-de-20h-du-mardi-15-octobre-2019_3632589.html","media":"France 2"}
{"date":"11/10/2019","datecharts":"2019-10-11","title":"Climat : changer de vie pour sauver la planète","url":"https://www.francetvinfo.fr/economie/emploi/climat-changer-de-vie-pour-sauver-la-planete_3656525.html","urlTvNews":"https://www.francetvinfo.fr/replay-jt/france-2/20-heures/jt-de-20h-du-samedi-12-octobre-2019_3632601.html","media":"France 2"}
{"date":"09/10/2019","datecharts":"2019-10-09","title":"Un aigle survole et filme les glaciers européens pour montrer les effets du réchauffement climatique","url":"https://www.tf1info.fr/environnement-ecologie/un-aigle-survole-et-filme-les-glaciers-europeens-pour-montrer-les-effets-du-rechauffement-climatique-2134653.html","urlTvNews":"https://www.tf1info.fr/emission/le-20h-11001/extraits/67.html","media":"TF1"}
{"date":"08/10/2019","datecharts":"2019-10-08","title":"Climat : les coquillages de l'Hérault meurent sous la chaleur","url":"https://www.francetvinfo.fr/meteo/climat/climat-les-coquillages-de-l-herault-meurent-sous-la-chaleur_3651869.html","urlTvNews":"https://www.francetvinfo.fr/replay-jt/france-2/20-heures/jt-de-20h-du-mercredi-9-octobre-2019_3622795.html","media":"France 2"}
{"date":"07/10/2019","datecharts":"2019-10-07","title":"Que sait-on des militants d'\"Extinction Rebellion\" ?","url":"https://www.tf1info.fr/societe/que-sait-on-des-militants-d-extinction-rebellion-2134454.html","urlTvNews":"https://www.tf1info.fr/emission/le-20h-11001/extraits/68.html","media":"TF1"}
{"date":"06/10/2019","datecharts":"2019-10-06","title":"Mont Blanc, la montagne qui s’effrite","url":"https://www.tf1info.fr/environnement-ecologie/mont-blanc-la-montagne-qui-s-effrite-2134369.html","urlTvNews":"https://www.tf1info.fr/emission/le-20h-11001/extraits/68.html","media":"TF1"}
{"date":"05/10/2019","datecharts":"2019-10-05","title":"Groenland : la ruée vers le Nord","url":"https://www.francetvinfo.fr/monde/usa/presidentielle/donald-trump/groenland-la-ruee-vers-le-nord_3647407.html","urlTvNews":"https://www.francetvinfo.fr/replay-jt/france-2/20-heures/jt-de-20h-du-dimanche-6-octobre-2019_3622801.html","media":"France 2"}
{"date":"29/09/2019","datecharts":"2019-09-29","title":"Réchauffement climatique : menace sur les remontées mécaniques","url":"https://www.francetvinfo.fr/meteo/climat/rechauffement-climatique-menace-sur-les-remontees-mecaniques_3638873.html","urlTvNews":"https://www.francetvinfo.fr/replay-jt/france-2/20-heures/jt-de-20h-du-lundi-30-septembre-2019_3613401.html","media":"France 2"}
{"date":"25/09/2019","datecharts":"2019-09-25","title":"Mort de Jacques Chirac : les discours marquants de l'ancien chef d'État","url":"https://www.francetvinfo.fr/culture/patrimoine/histoire/mort-de-jacques-chirac-les-discours-marquants-de-l-ancien-chef-d-etat_3633685.html","urlTvNews":"https://www.francetvinfo.fr/replay-jt/france-2/20-heures/jt-de-20h-du-jeudi-26-septembre-2019_3605427.html","media":"France 2"}
{"date":"24/09/2019","datecharts":"2019-09-24","title":"\"Une minute pour comprendre\" le réchauffement climatique","url":"https://www.tf1info.fr/environnement-ecologie/une-minute-pour-comprendre-le-rechauffement-climatique-2133220.html","urlTvNews":"https://www.tf1info.fr/emission/le-20h-11001/extraits/69.html","media":"TF1"}
{"date":"24/09/2019","datecharts":"2019-09-24","title":"Réchauffement climatique : un glacier du versant italien du Mont-Blanc pourrait s'effondrer","url":"https://www.francetvinfo.fr/meteo/climat/rechauffement-climatique-un-glacier-du-versant-italien-du-mont-blanc-pourrait-s-effondrer_3631973.html","urlTvNews":"https://www.francetvinfo.fr/replay-jt/france-2/20-heures/jt-de-20h-du-mercredi-25-septembre-2019_3603899.html","media":"France 2"}
{"date":"23/09/2019","datecharts":"2019-09-23","title":"Groenland : pêcheurs et agriculteurs se félicitent du réchauffement climatique","url":"https://www.francetvinfo.fr/economie/emploi/metiers/agriculture/groenland-pecheurs-et-agriculteurs-se-felicitent-du-rechauffement-climatique_3630467.html","urlTvNews":"https://www.francetvinfo.fr/replay-jt/france-2/20-heures/jt-de-20h-du-mardi-24-septembre-2019_3603901.html","media":"France 2"}
{"date":"23/09/2019","datecharts":"2019-09-23","title":"Greta Thunberg : pourquoi attaque-t-elle la France ?","url":"https://www.francetvinfo.fr/monde/environnement/greta-thunberg/greta-thunberg-pourquoi-attaque-t-elle-la-france_3630523.html","urlTvNews":"https://www.francetvinfo.fr/replay-jt/france-2/20-heures/jt-de-20h-du-mardi-24-septembre-2019_3603901.html","media":"France 2"}
{"date":"18/09/2019","datecharts":"2019-09-18","title":"Réchauffement climatique : quelles conséquences en cas de montée des océans ?","url":"https://www.francetvinfo.fr/meteo/climat/rechauffement-climatique-quelles-consequences-en-cas-de-montee-des-oceans_3623825.html","urlTvNews":"https://www.francetvinfo.fr/replay-jt/france-2/20-heures/jt-de-20h-du-jeudi-19-septembre-2019_3596395.html","media":"France 2"}
{"date":"18/09/2019","datecharts":"2019-09-18","title":"Réchauffement climatique : quatre îles englouties sur le golfe du Bengale","url":"https://www.francetvinfo.fr/monde/inde/rechauffement-climatique-quatre-iles-englouties-sur-le-golfe-du-bengale_3623823.html","urlTvNews":"https://www.francetvinfo.fr/replay-jt/france-2/20-heures/jt-de-20h-du-jeudi-19-septembre-2019_3596395.html","media":"France 2"}
{"date":"16/09/2019","datecharts":"2019-09-16","title":"Réchauffement climatique : les prévisions encore plus sombres","url":"https://www.francetvinfo.fr/meteo/climat/rechauffement-climatique-les-previsions-encore-plus-sombres_3620737.html","urlTvNews":"https://www.francetvinfo.fr/replay-jt/france-2/20-heures/jt-de-20h-du-mardi-17-septembre-2019_3594927.html","media":"France 2"}
{"date":"10/09/2019","datecharts":"2019-09-10","title":"États-Unis : quand le sel dégrade les terres cultivables","url":"https://www.francetvinfo.fr/monde/usa/etats-unis-quand-le-sel-degrade-les-terres-cultivables_3612863.html","urlTvNews":"https://www.francetvinfo.fr/replay-jt/france-2/20-heures/jt-de-20h-du-mercredi-11-septembre-2019_3585875.html","media":"France 2"}
{"date":"09/09/2019","datecharts":"2019-09-09","title":"Alpes : le corps d'un alpiniste disparu en 1976 retrouvé par son meilleur ami","url":"https://www.francetvinfo.fr/faits-divers/alpes-le-corps-d-un-alpiniste-disparu-en-1976-retrouve-par-son-meilleur-ami_3611465.html","urlTvNews":"https://www.francetvinfo.fr/replay-jt/france-2/20-heures/jt-de-20h-du-mardi-10-septembre-2019_3585877.html","media":"France 2"}
{"date":"03/09/2019","datecharts":"2019-09-03","title":"Morvan : la sécheresse menace la principale forêt fournissant les sapins de Noël","url":"https://www.tf1info.fr/societe/morvan-la-secheresse-menace-la-principale-foret-fournissant-les-sapins-de-noel-2131310.html","urlTvNews":"https://www.tf1info.fr/emission/le-20h-11001/extraits/70.html","media":"TF1"}
{"date":"02/09/2019","datecharts":"2019-09-02","title":"Le vrai du faux sur les cyclones","url":"https://www.tf1info.fr/meteo/le-vrai-du-faux-sur-les-cyclones-2131200.html","urlTvNews":"https://www.tf1info.fr/emission/le-20h-11001/extraits/71.html","media":"TF1"}
{"date":"01/09/2019","datecharts":"2019-09-01","title":"Alpes : le glacier de Sarenne bientôt disparu","url":"https://www.francetvinfo.fr/meteo/climat/alpes-le-glacier-de-sarenne-bientot-disparu_3600717.html","urlTvNews":"https://www.francetvinfo.fr/replay-jt/france-2/20-heures/jt-de-20h-du-lundi-2-septembre-2019_3576229.html","media":"France 2"}
{"date":"01/09/2019","datecharts":"2019-09-01","title":"Météo : pourquoi l'ouragan Dorian est exceptionnel","url":"https://www.francetvinfo.fr/monde/ameriques/ouragan-dorian/meteo-pourquoi-l-ouragan-dorian-est-exceptionnel_3600695.html","urlTvNews":"https://www.francetvinfo.fr/replay-jt/france-2/20-heures/jt-de-20h-du-lundi-2-septembre-2019_3576229.html","media":"France 2"}
{"date":"24/08/2019","datecharts":"2019-08-24","title":"Camargue : au cœur d'un safari made in France","url":"https://www.francetvinfo.fr/monde/environnement/biodiversite/camargue-au-coeur-d-un-safari-made-in-france_3590321.html","urlTvNews":"https://www.francetvinfo.fr/replay-jt/france-2/20-heures/jt-de-20h-du-dimanche-25-aout-2019_3569049.html","media":"France 2"}
{"date":"17/08/2019","datecharts":"2019-08-17","title":"Mer : à la découverte des posidonies, véritables prairies sous-marines","url":"https://www.francetvinfo.fr/meteo/climat/mer-a-la-decouverte-des-posidonies-veritables-prairies-sous-marines_3581481.html","urlTvNews":"https://www.francetvinfo.fr/replay-jt/france-2/20-heures/jt-de-20h-du-dimanche-18-aout-2019_3559947.html","media":"France 2"}
{"date":"14/08/2019","datecharts":"2019-08-14","title":"Les habitants de l'Île-Tudy se mobilisent pour sauver leur côte","url":"https://www.tf1info.fr/environnement-ecologie/les-habitants-de-l-ile-tudy-se-mobilisent-pour-sauver-leur-cote-2129649.html","urlTvNews":"https://www.tf1info.fr/emission/le-20h-11001/extraits/72.html","media":"TF1"}
{"date":"11/08/2019","datecharts":"2019-08-11","title":"Alpes suisses : la vallée des cascades","url":"https://www.tf1info.fr/voyages/alpes-suisses-la-vallee-des-cascades-2129419.html","urlTvNews":"https://www.tf1info.fr/emission/le-20h-11001/extraits/72.html","media":"TF1"}
{"date":"07/08/2019","datecharts":"2019-08-07","title":"Manger moins de viande pour sauver la planète ?","url":"https://www.tf1info.fr/environnement-ecologie/manger-moins-de-viande-pour-sauver-la-planete-2129132.html","urlTvNews":"https://www.tf1info.fr/emission/le-20h-11001/extraits/73.html","media":"TF1"}
{"date":"06/08/2019","datecharts":"2019-08-06","title":"Pénurie d'eau : un quart de la population mondiale menacée","url":"https://www.tf1info.fr/societe/penurie-d-eau-un-quart-de-la-population-mondiale-menacee-2129077.html","urlTvNews":"https://www.tf1info.fr/emission/le-20h-11001/extraits/73.html","media":"TF1"}
{"date":"04/08/2019","datecharts":"2019-08-04","title":"Climat : le pôle Nord se réchauffe deux fois plus vite que le reste de la planète","url":"https://www.francetvinfo.fr/meteo/climat/climat-le-pole-nord-se-rechauffe-deux-fois-plus-vite-que-le-reste-de-la-planete_3565901.html","urlTvNews":"https://www.francetvinfo.fr/replay-jt/france-2/20-heures/jt-de-20h-du-lundi-5-aout-2019_3540891.html","media":"France 2"}
{"date":"02/08/2019","datecharts":"2019-08-02","title":"Environnement : l'érosion des roches dans les Alpes inquiète","url":"https://www.francetvinfo.fr/meteo/climat/environnement-l-erosion-des-roches-dans-les-alpes-inquiete_3563419.html","urlTvNews":"https://www.francetvinfo.fr/replay-jt/france-2/20-heures/jt-de-20h-du-samedi-3-aout-2019_3540941.html","media":"France 2"}
{"date":"30/07/2019","datecharts":"2019-07-30","title":"Changement climatique : des agriculteurs du Vaucluse adaptent leurs cultures","url":"https://www.tf1info.fr/environnement-ecologie/changement-climatique-des-agriculteurs-du-vaucluse-adaptent-leurs-cultures-2128534.html","urlTvNews":"https://www.tf1info.fr/emission/le-20h-11001/extraits/73.html","media":"TF1"}
{"date":"29/07/2019","datecharts":"2019-07-29","title":"Sécheresse : une facture lourde pour les assurances","url":"https://www.tf1info.fr/societe/secheresse-une-facture-lourde-pour-les-assurances-2128435.html","urlTvNews":"https://www.tf1info.fr/emission/le-20h-11001/extraits/73.html","media":"TF1"}
{"date":"27/07/2019","datecharts":"2019-07-27","title":"Environnement : une exploration hors norme sous la mer méditerranée","url":"https://www.francetvinfo.fr/monde/environnement/biodiversite/environnement-une-exploration-hors-norme-sous-la-mer-mediterranee_3555481.html","urlTvNews":"https://www.francetvinfo.fr/replay-jt/france-2/20-heures/jt-de-20h-du-dimanche-28-juillet-2019_3530719.html","media":"France 2"}
{"date":"25/07/2019","datecharts":"2019-07-25","title":"Sécheresse : des maisons fissurées dans plusieurs départements","url":"https://www.francetvinfo.fr/meteo/secheresse/secheresse-des-maisons-fissurees-dans-plusieurs-departements_3553057.html","urlTvNews":"https://www.francetvinfo.fr/replay-jt/france-2/20-heures/jt-de-20h-du-vendredi-26-juillet-2019_3523879.html","media":"France 2"}
{"date":"24/07/2019","datecharts":"2019-07-24","title":"Réchauffement climatique : des chaleurs inédites et planétaires","url":"https://www.francetvinfo.fr/meteo/climat/rechauffement-climatique-des-chaleurs-inedites-et-planetaires_3551447.html","urlTvNews":"https://www.francetvinfo.fr/replay-jt/france-2/20-heures/jt-de-20h-du-jeudi-25-juillet-2019_3522147.html","media":"France 2"}
{"date":"23/07/2019","datecharts":"2019-07-23","title":"Tours, une ville face au changement climatique","url":"https://www.tf1info.fr/environnement-ecologie/tours-une-ville-face-au-changement-climatique-2127902.html","urlTvNews":"https://www.tf1info.fr/emission/le-20h-11001/extraits/74.html","media":"TF1"}
{"date":"23/07/2019","datecharts":"2019-07-23","title":"Records de températures : \"Cette journée pourrait entrer dans l'histoire\"","url":"https://www.francetvinfo.fr/meteo/climat/records-de-temperatures-cette-journee-pourrait-entrer-dans-l-histoire_3549837.html","urlTvNews":"https://www.francetvinfo.fr/replay-jt/france-2/20-heures/jt-de-20h-du-mercredi-24-juillet-2019_3520385.html","media":"France 2"}
{"date":"22/07/2019","datecharts":"2019-07-22","title":"Greta Thunberg : pourquoi la jeune militante écologiste dérange ?","url":"https://www.tf1info.fr/environnement-ecologie/greta-thunberg-pourquoi-la-jeune-militante-ecologiste-derange-2127809.html","urlTvNews":"https://www.tf1info.fr/emission/le-20h-11001/extraits/74.html","media":"TF1"}
{"date":"20/07/2019","datecharts":"2019-07-20","title":"Environnement : la Floride bientôt sous les eaux ?","url":"https://www.francetvinfo.fr/faits-divers/requins/oceans-plongee-dans-les-abysses_3544587.html","urlTvNews":"https://www.francetvinfo.fr/replay-jt/france-2/20-heures/jt-de-20h-du-dimanche-21-juillet-2019_3520433.html","media":"France 2"}
{"date":"15/07/2019","datecharts":"2019-07-15","title":"Intempéries en Corse : pourquoi et comment se forment les trombes marines ?","url":"https://www.tf1info.fr/meteo/meteo-france-intemperies-en-corse-pourquoi-et-comment-se-forment-les-trombes-marines-2127091.html","urlTvNews":"https://www.tf1info.fr/emission/le-20h-11001/extraits/75.html","media":"TF1"}
{"date":"15/07/2019","datecharts":"2019-07-15","title":"Comment sauver les séquoias géants d'Amérique ? En les clonant !","url":"https://www.tf1info.fr/environnement-ecologie/le-clonage-des-sequoias-geants-d-amerique-2127210.html","urlTvNews":"https://www.tf1info.fr/emission/le-20h-11001/extraits/75.html","media":"TF1"}
{"date":"08/07/2019","datecharts":"2019-07-08","title":"Moustique tigre : comment les autorités gèrent sa prolifération","url":"https://www.francetvinfo.fr/sante/maladie/chikungunya/moustique-tigre-comment-les-autorites-gerent-sa-proliferation_3528777.html","urlTvNews":"https://www.francetvinfo.fr/replay-jt/france-2/20-heures/jt-de-20h-du-mardi-9-juillet-2019_3500311.html","media":"France 2"}
{"date":"08/07/2019","datecharts":"2019-07-08","title":"Invasion d'animaux : le vrai du faux","url":"https://www.tf1info.fr/societe/invasion-d-animaux-le-vrai-du-faux-2126571.html","urlTvNews":"https://www.tf1info.fr/emission/le-20h-11001/extraits/75.html","media":"TF1"}
{"date":"06/07/2019","datecharts":"2019-07-06","title":"Orages : les averses de grêles sont-elles plus fréquentes et intenses ?","url":"https://www.francetvinfo.fr/meteo/orages/orages-pourquoi-les-averses-de-greles-sont-elles-plus-frequentes-et-intenses_3525759.html","urlTvNews":"https://www.francetvinfo.fr/replay-jt/france-2/20-heures/jt-de-20h-du-dimanche-7-juillet-2019_3500315.html","media":"France 2"}
{"date":"06/07/2019","datecharts":"2019-07-06","title":"Sécheresse : les producteurs de maïs font grise mine","url":"https://www.francetvinfo.fr/economie/emploi/metiers/agriculture/secheresse-les-producteurs-de-mais-font-grise-mine_3525775.html","urlTvNews":"https://www.francetvinfo.fr/replay-jt/france-2/20-heures/jt-de-20h-du-dimanche-7-juillet-2019_3500315.html","media":"France 2"}
{"date":"05/07/2019","datecharts":"2019-07-05","title":"Viticulture : bientôt des vignes qui survivent au réchauffement climatique ?","url":"https://www.francetvinfo.fr/economie/emploi/metiers/agriculture/viticulture-bientot-des-vignes-qui-survivent-au-rechauffement-climatique_3524461.html","urlTvNews":"https://www.francetvinfo.fr/replay-jt/france-2/20-heures/jt-de-20h-du-samedi-6-juillet-2019_3500343.html","media":"France 2"}
{"date":"30/06/2019","datecharts":"2019-06-30","title":"Polynésie : les jardiniers du corail se battent pour la survie du récif","url":"https://www.francetvinfo.fr/meteo/climat/polynesie-les-jardiniers-du-corail-se-battent-pour-la-survie-du-recif_3516505.html","urlTvNews":"https://www.francetvinfo.fr/replay-jt/france-2/20-heures/jt-de-20h-du-lundi-1-juillet-2019_3487557.html","media":"France 2"}
{"date":"27/06/2019","datecharts":"2019-06-27","title":"Canicule : les records de températures, symptômes du réchauffement climatique","url":"https://www.francetvinfo.fr/meteo/climat/canicule-les-records-de-temperatures-symptomes-du-rechauffement-climatique_3512601.html","urlTvNews":"https://www.francetvinfo.fr/replay-jt/france-2/20-heures/jt-de-20h-du-vendredi-28-juin-2019_3480687.html","media":"France 2"}
{"date":"25/06/2019","datecharts":"2019-06-25","title":"Climatisation : la fraicheur à double tranchant","url":"https://www.francetvinfo.fr/meteo/climat/climatisation-la-fraicheur-a-double-tranchant_3508979.html","urlTvNews":"https://www.francetvinfo.fr/replay-jt/france-2/20-heures/jt-de-20h-du-mercredi-26-juin-2019_3477271.html","media":"France 2"}
{"date":"24/06/2019","datecharts":"2019-06-24","title":"Meuse : les dégâts de la chaleur sur les maisons","url":"https://www.francetvinfo.fr/meteo/canicule/meuse-les-degats-de-la-chaleur-sur-les-maisons_3507257.html","urlTvNews":"https://www.francetvinfo.fr/replay-jt/france-2/20-heures/jt-de-20h-du-mardi-25-juin-2019_3477275.html","media":"France 2"}
{"date":"23/06/2019","datecharts":"2019-06-23","title":"Strasbourg : des différences de chaleur liées à l'urbanisme","url":"https://www.francetvinfo.fr/meteo/canicule/strasbourg-des-differences-de-chaleur-liees-a-l-urbanisme_3505741.html","urlTvNews":"https://www.francetvinfo.fr/replay-jt/france-2/20-heures/jt-de-20h-du-lundi-24-juin-2019_3477279.html","media":"France 2"}
{"date":"23/06/2019","datecharts":"2019-06-23","title":"Canicule : quelles sont ses causes ?","url":"https://www.francetvinfo.fr/meteo/climat/canicule-quelles-sont-ses-causes_3505721.html","urlTvNews":"https://www.francetvinfo.fr/replay-jt/france-2/20-heures/jt-de-20h-du-lundi-24-juin-2019_3477279.html","media":"France 2"}
{"date":"10/06/2019","datecharts":"2019-06-10","title":"Italie : des millions de sauterelles ravagent les champs de Sardaigne","url":"https://www.francetvinfo.fr/sante/environnement-et-sante/sauterelles-les-champs-de-sardaigne-litteralement-envahis_3485319.html","urlTvNews":"https://www.francetvinfo.fr/replay-jt/france-2/20-heures/jt-de-20h-du-mardi-11-juin-2019_3456105.html","media":"France 2"}
{"date":"28/05/2019","datecharts":"2019-05-28","title":"Nature : l'Afrique du Sud, territoire refuge pour les manchots","url":"https://www.francetvinfo.fr/monde/afrique/afrique-du-sud/nature-l-afrique-du-sud-territoire-refuge-pour-les-manchots_3466423.html","urlTvNews":"https://www.francetvinfo.fr/replay-jt/france-2/20-heures/jt-de-20h-du-mercredi-29-mai-2019_3435123.html","media":"France 2"}
{"date":"20/05/2019","datecharts":"2019-05-20","title":"New York : 1 milliard d’huîtres pour protéger la baie","url":"https://www.francetvinfo.fr/monde/environnement/biodiversite/new-york-1-milliard-dhuitres-pour-proteger-la-baie_3453991.html","urlTvNews":"https://www.francetvinfo.fr/replay-jt/france-2/20-heures/jt-de-20h-du-mardi-21-mai-2019_3423285.html","media":"France 2"}
{"date":"17/05/2019","datecharts":"2019-05-17","title":"Mauritanie : menace sur le refuge des oiseaux","url":"https://www.francetvinfo.fr/monde/afrique/mauritanie/mauritanie-menace-sur-le-refuge-des-oiseaux_3449583.html","urlTvNews":"https://www.francetvinfo.fr/replay-jt/france-2/20-heures/jt-de-20h-du-samedi-18-mai-2019_3423297.html","media":"France 2"}
{"date":"05/05/2019","datecharts":"2019-05-05","title":"États-Unis : les abeilles au secours des amandes californiennes","url":"https://www.francetvinfo.fr/economie/emploi/metiers/agriculture/etats-unis-les-abeilles-au-secours-des-amandes-californiennes_3431677.html","urlTvNews":"https://www.francetvinfo.fr/replay-jt/france-2/20-heures/jt-de-20h-du-lundi-6-mai-2019_3403755.html","media":"France 2"}
{"date":"27/04/2019","datecharts":"2019-04-27","title":"En Nouvelle-Zélande, les glaciers gravement menacés par le réchauffement climatique","url":"https://www.francetvinfo.fr/meteo/climat/nouvelle-zelande-les-glaciers-gravement-menaces-par-le-rechauffement-climatique_3419439.html","urlTvNews":"https://www.francetvinfo.fr/replay-jt/france-2/20-heures/jt-de-20h-du-dimanche-28-avril-2019_3311971.html","media":"France 2"}
{"date":"22/04/2019","datecharts":"2019-04-22","title":"Vins anglais : doit-on craindre la concurrence ?","url":"https://www.tf1info.fr/international/vins-anglais-doit-on-craindre-la-concurrence-2119260.html","urlTvNews":"https://www.tf1info.fr/emission/le-20h-11001/extraits/81.html","media":"TF1"}
{"date":"18/04/2019","datecharts":"2019-04-18","title":"Bangladesh : des écoles flottantes pour s'adapter à la montée des eaux","url":"https://www.francetvinfo.fr/monde/bangladesh/bangladesh-des-ecoles-flottantes-pour-s-adapter-a-la-montee-des-eaux_3406475.html","urlTvNews":"https://www.francetvinfo.fr/replay-jt/france-2/20-heures/jt-de-20h-du-vendredi-19-avril-2019_3257213.html","media":"France 2"}
{"date":"04/04/2019","datecharts":"2019-04-04","title":"L'envers du décor : une usine d'électricité cachée sous la glace","url":"https://www.francetvinfo.fr/economie/industrie/l-envers-du-decor-une-usine-d-electricite-cachee-sous-la-glace_3267599.html","urlTvNews":"https://www.francetvinfo.fr/replay-jt/france-2/20-heures/jt-de-20h-du-vendredi-5-avril-2019_3235941.html","media":"France 2"}
{"date":"02/04/2019","datecharts":"2019-04-02","title":"La grande barrière de corail, un trésor à sauver","url":"https://www.francetvinfo.fr/monde/environnement/la-grande-barriere-de-corail-un-tresor-a-sauver_3264199.html","urlTvNews":"https://www.francetvinfo.fr/replay-jt/france-2/20-heures/jt-de-20h-du-mercredi-3-avril-2019_3232487.html","media":"France 2"}
{"date":"19/03/2019","datecharts":"2019-03-19","title":"VIDÉO - De 3% des Français touchés en 1970 à 30% aujourd'hui : pourquoi les allergies explosent-elles ?","url":"https://www.tf1info.fr/sante/video-de-3-des-francais-touches-en-1970-a-30-aujourd-hui-pourquoi-les-allergies-respiratoires-explosent-elles-2115963.html","urlTvNews":"https://www.tf1info.fr/emission/le-20h-11001/extraits/84.html","media":"TF1"}
{"date":"15/03/2019","datecharts":"2019-03-15","title":"Marche pour le climat : des milliers de manifestants partout en France","url":"https://www.francetvinfo.fr/societe/education/parcoursup/parcoursup/manifestations-des-lyceens/marche-pour-le-climat-des-milliers-de-manifestants-partout-en-france_3236501.html","urlTvNews":"https://www.francetvinfo.fr/replay-jt/france-2/20-heures/jt-de-20h-du-samedi-16-mars-2019_3220183.html","media":"France 2"}
{"date":"13/03/2019","datecharts":"2019-03-13","title":"Plainte pour le climat : le précédent hollandais","url":"https://www.francetvinfo.fr/monde/pays-bas/plainte-pour-le-climat-le-precedent-hollandais_3233529.html","urlTvNews":"https://www.francetvinfo.fr/replay-jt/france-2/20-heures/jt-de-20h-du-jeudi-14-mars-2019_3202085.html","media":"France 2"}
{"date":"01/03/2019","datecharts":"2019-03-01","title":"Nouvelle-Calédonie : la barrière de corail en danger","url":"https://www.francetvinfo.fr/monde/environnement/nouvelle-caledonie-la-barriere-de-corail-en-danger_3215005.html","urlTvNews":"https://www.francetvinfo.fr/replay-jt/france-2/20-heures/jt-de-20h-du-samedi-2-mars-2019_3198683.html","media":"France 2"}
{"date":"25/02/2019","datecharts":"2019-02-25","title":"Réchauffement climatique : encore une année record en 2019 ?","url":"https://www.tf1info.fr/meteo/rechauffement-climatique-encore-une-annee-record-en-2019-2114110.html","urlTvNews":"https://www.tf1info.fr/emission/le-20h-11001/extraits/86.html","media":"TF1"}
{"date":"24/02/2019","datecharts":"2019-02-24","title":"Météo : la planète est-elle devenue folle ?","url":"https://www.tf1info.fr/meteo/meteo-la-planete-est-elle-devenue-folle-2113969.html","urlTvNews":"https://www.tf1info.fr/emission/le-20h-11001/extraits/86.html","media":"TF1"}
{"date":"13/02/2019","datecharts":"2019-02-13","title":"Réchauffement climatique : les ours polaires aux portes des maisons","url":"https://www.tf1info.fr/international/rechauffement-climatique-les-ours-polaires-aux-portes-des-maisons-2112997.html","urlTvNews":"https://www.tf1info.fr/emission/le-20h-11001/extraits/86.html","media":"TF1"}
{"date":"11/02/2019","datecharts":"2019-02-11","title":"Les insectes en voie de disparition","url":"https://www.tf1info.fr/environnement-ecologie/les-insectes-en-voie-de-disparition-2112768.html","urlTvNews":"https://www.tf1info.fr/emission/le-20h-11001/extraits/87.html","media":"TF1"}
{"date":"10/02/2019","datecharts":"2019-02-10","title":"Russie : quand des ours polaires envahissent la ville","url":"https://www.francetvinfo.fr/monde/russie/russie-quand-des-ours-polaires-envahissent-la-ville_3186033.html","urlTvNews":"https://www.francetvinfo.fr/replay-jt/france-2/20-heures/jt-de-20h-du-lundi-11-fevrier-2019_3159487.html","media":"France 2"}
{"date":"10/02/2019","datecharts":"2019-02-10","title":"Pakistan : 1 milliard d'arbres plantés pour l'avenir","url":"https://www.francetvinfo.fr/monde/environnement/pakistan-1-milliard-d-arbres-plantes-pour-l-avenir_3186051.html","urlTvNews":"https://www.francetvinfo.fr/replay-jt/france-2/20-heures/jt-de-20h-du-lundi-11-fevrier-2019_3159487.html","media":"France 2"}
{"date":"06/02/2019","datecharts":"2019-02-06","title":"Floride : des îles si fragiles","url":"https://www.tf1info.fr/international/floride-des-iles-si-fragiles-2112337.html","urlTvNews":"https://www.tf1info.fr/emission/le-20h-11001/extraits/87.html","media":"TF1"}
{"date":"28/01/2019","datecharts":"2019-01-28","title":"États-Unis : jusqu'à -54°C dans certains endroits","url":"https://www.francetvinfo.fr/meteo/inondations/etats-unis-jusqu-a-54c-dans-certains-endroits_3166969.html","urlTvNews":"https://www.francetvinfo.fr/replay-jt/france-2/20-heures/jt-de-20h-du-mardi-29-janvier-2019_3137951.html","media":"France 2"}
{"date":"27/01/2019","datecharts":"2019-01-27","title":"Égypte : le Delta du Nil menacé par le réchauffement ?","url":"https://www.tf1info.fr/international/egypte-le-delta-du-nil-menace-par-le-rechauffement-2111447.html","urlTvNews":"https://www.tf1info.fr/emission/le-20h-11001/extraits/88.html","media":"TF1"}
{"date":"20/01/2019","datecharts":"2019-01-20","title":"Réchauffement climatique : les oiseaux migrateurs perdent la boussole","url":"https://www.francetvinfo.fr/monde/israel/rechauffement-climatique-les-oiseaux-migrateurs-perdent-la-boussole_3155945.html","urlTvNews":"https://www.francetvinfo.fr/replay-jt/france-2/20-heures/jt-de-20h-du-lundi-21-janvier-2019_3127611.html","media":"France 2"}
{"date":"15/01/2019","datecharts":"2019-01-15","title":"Grand débat national : Mélenchon dénonce \"une supercherie\"","url":"https://www.francetvinfo.fr/politique/emmanuel-macron/grand-debat-national-melenchon-denonce-une-supercherie_3148011.html","urlTvNews":"https://www.francetvinfo.fr/replay-jt/france-2/20-heures/jt-de-20h-du-mercredi-16-janvier-2019_3118577.html","media":"France 2"}
{"date":"07/01/2019","datecharts":"2019-01-07","title":"Écologie : ces vêtements qui polluent","url":"https://www.francetvinfo.fr/economie/industrie/ecologie-ces-vetements-qui-polluent_3135657.html","urlTvNews":"https://www.francetvinfo.fr/replay-jt/france-2/20-heures/jt-de-20h-du-mardi-8-janvier-2019_3109569.html","media":"France 2"}
{"date":"02/01/2019","datecharts":"2019-01-02","title":"Réchauffement climatique : une modification de notre alimentation","url":"https://www.francetvinfo.fr/economie/emploi/metiers/agriculture/rechauffement-climatique-une-modification-de-notre-alimentation_3128341.html","urlTvNews":"https://www.francetvinfo.fr/replay-jt/france-2/20-heures/jt-de-20h-du-jeudi-3-janvier-2019_3100163.html","media":"France 2"}
{"date":"02/01/2019","datecharts":"2019-01-02","title":"Réchauffement : le climat dérègle l'agriculture","url":"https://www.francetvinfo.fr/economie/emploi/metiers/agriculture/rechauffement-le-climat-deregle-l-agriculture_3128331.html","urlTvNews":"https://www.francetvinfo.fr/replay-jt/france-2/20-heures/jt-de-20h-du-jeudi-3-janvier-2019_3100163.html","media":"France 2"}
{"date":"25/12/2018","datecharts":"2018-12-25","title":"Baie de Somme : 80% des poissons ont disparu","url":"https://www.tf1info.fr/regions/baie-de-somme-80-des-poissons-ont-disparu-2108568.html","urlTvNews":"https://www.tf1info.fr/emission/le-20h-11001/extraits/91.html","media":"TF1"}
{"date":"18/12/2018","datecharts":"2018-12-18","title":"Energie solaire : la centrale de la discorde","url":"https://www.francetvinfo.fr/monde/environnement/energie-solaire-la-centrale-de-la-discorde_3108373.html","urlTvNews":"https://www.francetvinfo.fr/replay-jt/france-2/20-heures/jt-de-20h-du-mercredi-19-decembre-2018_3077091.html","media":"France 2"}
{"date":"15/12/2018","datecharts":"2018-12-15","title":"Quel bilan climatique dresser à l'issue de la COP24 ?","url":"https://www.francetvinfo.fr/monde/environnement/alerte-pollution/quel-bilan-climatique-dresser-a-l-issue-de-la-cop24_3103781.html","urlTvNews":"https://www.francetvinfo.fr/replay-jt/france-2/20-heures/jt-de-20h-du-dimanche-16-decembre-2018_3077103.html","media":"France 2"}
{"date":"30/10/2018","datecharts":"2018-10-30","title":"Les animaux sauvages menacés d'une extinction de masse","url":"https://www.tf1info.fr/environnement-ecologie/les-animaux-sauvages-menaces-d-une-extinction-de-masse-2103078.html","urlTvNews":"https://www.tf1info.fr/emission/le-20h-11001/extraits/95.html","media":"TF1"}
{"date":"30/10/2018","datecharts":"2018-10-30","title":"Énergie : pourquoi la facture \"explose\"-t-elle ?","url":"https://www.francetvinfo.fr/economie/budget/energie-pourquoi-la-facture-explose-t-elle_3012829.html","urlTvNews":"https://www.francetvinfo.fr/replay-jt/france-2/20-heures/jt-de-20h-du-mercredi-31-octobre-2018_2980413.html","media":"France 2"}
{"date":"21/10/2018","datecharts":"2018-10-21","title":"Alimentation : faut-il renoncer à la viande ?","url":"https://www.francetvinfo.fr/animaux/bien-etre-animal/maltraitance-dans-les-abattoirs/alimentation-faut-il-renoncer-a-la-viande_2998755.html","urlTvNews":"https://www.francetvinfo.fr/replay-jt/france-2/20-heures/jt-de-20h-du-lundi-22-octobre-2018_2969727.html","media":"France 2"}
